video_id,start,duration,text
MCAPRAEG9wk,0.0,6.28,"Hi guys, welcome back to another episode"
MCAPRAEG9wk,2.52,6.64,of Two Hot Takes. I'm your host Morgan.
MCAPRAEG9wk,6.28,4.8,I'm Justin. And I'm Lauren.
MCAPRAEG9wk,9.16,4.32,You've been asking
MCAPRAEG9wk,11.08,5.64,for stories that [ __ ] you up.
MCAPRAEG9wk,13.48,4.84,"Mhm. You wanted crazy, wanted out there."
MCAPRAEG9wk,16.72,2.56,"Mhm. Who, you? Yeah."
MCAPRAEG9wk,18.32,1.48,"Oh, I thought we were talking about the"
MCAPRAEG9wk,19.28,3.48,fan base.
MCAPRAEG9wk,19.8,5.08,"No, I I me, you, Lauren. I literally"
MCAPRAEG9wk,22.76,4.4,will listen to yours and Alejandra's and
MCAPRAEG9wk,24.88,3.76,"I'm like, ""Oh my god."" And I'm in my car"
MCAPRAEG9wk,27.16,3.12,"and I'm like,"
MCAPRAEG9wk,28.64,3.76,"""Listen here, honey."" Pretending I'm"
MCAPRAEG9wk,30.28,4.36,like OP.
MCAPRAEG9wk,32.4,3.48,You're like getting the mild ones.
MCAPRAEG9wk,34.64,3.6,"Yeah, but I mean"
MCAPRAEG9wk,35.88,4.92,Lauren wants the hot seat. She wants
MCAPRAEG9wk,38.24,3.2,"She wants the heat. Yeah, just a little"
MCAPRAEG9wk,40.8,1.0,bit.
MCAPRAEG9wk,41.44,1.68,seat.
MCAPRAEG9wk,41.8,2.92,But it's always funny because it's so
MCAPRAEG9wk,43.12,3.4,much easier to
MCAPRAEG9wk,44.72,6.0,form your thoughts
MCAPRAEG9wk,46.52,5.28,about the stories when you're not
MCAPRAEG9wk,50.72,3.0,like
MCAPRAEG9wk,51.8,3.6,"Yeah, those don't sound clear."
MCAPRAEG9wk,53.72,3.52,Everything seems to make sense cuz
MCAPRAEG9wk,55.4,4.72,"whenever I'm driving, sometimes I'll"
MCAPRAEG9wk,57.24,5.28,literally turn my radio off or my
MCAPRAEG9wk,60.12,4.04,podcast off and I say my response out
MCAPRAEG9wk,62.52,3.72,"loud and I'm like, ""Wow, I nailed that"
MCAPRAEG9wk,64.16,3.64,"one."" Yeah, even when it's the one you"
MCAPRAEG9wk,66.24,2.72,already were on.
MCAPRAEG9wk,67.8,3.2,And you already responded to.
MCAPRAEG9wk,68.96,3.96,I literally do the same thing. I think
MCAPRAEG9wk,71.0,3.76,it's it's crazy too because I'll be
MCAPRAEG9wk,72.92,3.64,listening like an episode the morning it
MCAPRAEG9wk,74.76,4.2,comes out just like kind of like proof
MCAPRAEG9wk,76.56,3.84,"checking again and I'll be like, ""Wait,"
MCAPRAEG9wk,78.96,3.16,"god, I should have said this right"
MCAPRAEG9wk,80.4,2.48,"here."" Like Ah."
MCAPRAEG9wk,82.12,3.44,been perfect.
MCAPRAEG9wk,82.88,4.24,"have been so good. Or like on YouTube, I"
MCAPRAEG9wk,85.56,3.48,like read the comments a lot on YouTube
MCAPRAEG9wk,87.12,3.28,to like respond to people and like have
MCAPRAEG9wk,89.04,4.36,conversations on there and someone would
MCAPRAEG9wk,90.4,4.52,"be like, ""Wait, what if he actually had"
MCAPRAEG9wk,93.4,2.96,the bag of IDs because it was something
MCAPRAEG9wk,94.92,3.04,"to do with sex trafficking."" And I'm"
MCAPRAEG9wk,96.36,3.4,"like,"
MCAPRAEG9wk,97.96,3.6,"""Maybe he's not a murderer. Maybe he's a"
MCAPRAEG9wk,99.76,3.04,"sex trafficker."" Like there's stuff you"
MCAPRAEG9wk,101.56,3.64,don't think about.
MCAPRAEG9wk,102.8,4.88,"Mhm. And I'm like, ""100%."" And my"
MCAPRAEG9wk,105.2,4.32,opinions change too. Like the more I
MCAPRAEG9wk,107.68,4.24,learn about some of these stories or
MCAPRAEG9wk,109.52,4.0,Mhm. or like new information I get from
MCAPRAEG9wk,111.92,3.4,people in the community like engaging
MCAPRAEG9wk,113.52,3.52,"on, you know, whatever. I feel like I'm"
MCAPRAEG9wk,115.32,2.92,"like, ""Wait, okay, I'm more educated"
MCAPRAEG9wk,117.04,2.64,"now."""
MCAPRAEG9wk,118.24,3.76,"Yeah, but then when we're then when"
MCAPRAEG9wk,119.68,4.88,"we're on with your dad, it's he'll be so"
MCAPRAEG9wk,122.0,4.48,adamant about a point and he'll keep
MCAPRAEG9wk,124.56,3.68,bringing it up until we argue it until
MCAPRAEG9wk,126.48,3.559,"the very end and then he'll be like,"
MCAPRAEG9wk,128.24,4.36,"""Well, maybe it is that."""
MCAPRAEG9wk,130.039,5.241,I know. He's just very He's very
MCAPRAEG9wk,132.6,5.32,"positive, very just like full of wisdom"
MCAPRAEG9wk,135.28,5.88,and I think that's like a great
MCAPRAEG9wk,137.92,4.84,"um like opposite of me who I'm like, I'm"
MCAPRAEG9wk,141.16,3.24,I kind of go the more pessimistic route
MCAPRAEG9wk,142.76,4.36,with these people because I
MCAPRAEG9wk,144.4,3.52,I read too much on Reddit and I I just
MCAPRAEG9wk,147.12,1.76,[ __ ] Yeah.
MCAPRAEG9wk,147.92,4.04,some [ __ ]
MCAPRAEG9wk,148.88,4.24,"Um So, there's that, but these stories"
MCAPRAEG9wk,151.96,3.96,today.
MCAPRAEG9wk,153.12,4.32,You wanted [ __ ] wild and I hope I'm
MCAPRAEG9wk,155.92,6.4,going to deliver
MCAPRAEG9wk,157.44,8.96,because this episode theme is unhinged.
MCAPRAEG9wk,162.32,4.08,"Let's do it. Okay, let's dive in."
MCAPRAEG9wk,174.24,5.12,"So, I actually mentioned this story on"
MCAPRAEG9wk,177.24,3.72,"Alejandra's episode, the mother-in-laws"
MCAPRAEG9wk,179.36,3.44,and moms episode.
MCAPRAEG9wk,180.96,3.88,And I mentioned it in regards to a
MCAPRAEG9wk,182.8,4.08,listener write-in and the listener was
MCAPRAEG9wk,184.84,4.24,"basically like, ""My mother-in-law, we"
MCAPRAEG9wk,186.88,4.44,went to a wedding recently and she kept
MCAPRAEG9wk,189.08,5.6,"introducing us in a weird way."""
MCAPRAEG9wk,191.32,5.88,"And she kept saying, ""This is my son,"
MCAPRAEG9wk,194.68,4.52,this is my daughter-in-law and this is
MCAPRAEG9wk,197.2,3.96,"my baby."" I heard that."
MCAPRAEG9wk,199.2,3.56,"pointing to her belly. And I was like,"
MCAPRAEG9wk,201.16,4.2,it sounded familiar to another Reddit
MCAPRAEG9wk,202.76,5.92,"story. So, I went in my archives, dug it"
MCAPRAEG9wk,205.36,4.56,"up. So, that's the one that's up first."
MCAPRAEG9wk,208.68,3.08,"But I do want to say, you know, we had a"
MCAPRAEG9wk,209.92,3.04,lot of positive comments on the YouTube
MCAPRAEG9wk,211.76,3.16,"that were like, ""Maybe it's a cultural"
MCAPRAEG9wk,212.96,5.16,thing. Like maybe she's being really
MCAPRAEG9wk,214.92,5.28,"nice, blah blah blah."" So, that being"
MCAPRAEG9wk,218.12,4.0,"said, I get some mother-in-laws are very"
MCAPRAEG9wk,220.2,6.32,"nice and just very friendly,"
MCAPRAEG9wk,222.12,7.28,but this story is what gave me my
MCAPRAEG9wk,226.52,4.12,uncomfy vibes and heebie-jeebies.
MCAPRAEG9wk,229.4,2.84,"Okay, you ready? We're ready."
MCAPRAEG9wk,230.64,5.32,Very ready.
MCAPRAEG9wk,232.24,7.28,My stepmom tried to walk out of my home
MCAPRAEG9wk,235.96,7.56,with her baby and told me she doesn't
MCAPRAEG9wk,239.52,6.6,need permission to leave with her baby.
MCAPRAEG9wk,243.52,4.56,And it wasn't her baby.
MCAPRAEG9wk,246.12,4.08,God damn it.
MCAPRAEG9wk,248.08,4.68,She married my dad when I was 15 and
MCAPRAEG9wk,250.2,4.52,"even though being 25 years age gap, she"
MCAPRAEG9wk,252.76,4.12,was more of an older sister and friend
MCAPRAEG9wk,254.72,3.72,rather than a parent. We remained like
MCAPRAEG9wk,256.88,4.44,this for a couple years and I looked up
MCAPRAEG9wk,258.44,4.64,to her a lot. Then the trouble started.
MCAPRAEG9wk,261.32,3.48,I'd only been with my boyfriend for two
MCAPRAEG9wk,263.08,4.36,and a half years before I found out I
MCAPRAEG9wk,264.8,4.76,"was pregnant. Not only were we happy,"
MCAPRAEG9wk,267.44,3.4,but my in-laws and my dad were happy for
MCAPRAEG9wk,269.56,4.16,us as well.
MCAPRAEG9wk,270.84,5.24,My stepmom wasn't. The excuses started.
MCAPRAEG9wk,273.72,4.04,I was too young. I wasn't married. This
MCAPRAEG9wk,276.08,4.56,wasn't an environment for the baby to
MCAPRAEG9wk,277.76,5.04,grow up in. She also wanted custody of
MCAPRAEG9wk,280.64,5.2,our baby and wasn't happy when we told
MCAPRAEG9wk,282.8,5.04,her we would be raising this baby.
MCAPRAEG9wk,285.84,4.08,This went on for a while. We were no
MCAPRAEG9wk,287.84,4.04,contact with her for a month.
MCAPRAEG9wk,289.92,3.56,That was when my dad fully spoke to her
MCAPRAEG9wk,291.88,3.8,and let her know her actions and words
MCAPRAEG9wk,293.48,4.68,need to be kept to themselves. We were
MCAPRAEG9wk,295.68,4.6,adults. We could make our own decisions.
MCAPRAEG9wk,298.16,3.28,She did apologize to us and promised to
MCAPRAEG9wk,300.28,3.24,stop.
MCAPRAEG9wk,301.44,4.08,We gave her another chance.
MCAPRAEG9wk,303.52,4.32,She had never done this before and she
MCAPRAEG9wk,305.52,4.4,"could have been afraid for us, but we"
MCAPRAEG9wk,307.84,3.68,told her that we would be fine and
MCAPRAEG9wk,309.92,4.4,always had things planned out if things
MCAPRAEG9wk,311.52,4.72,changed in a heartbeat. She seemed fine
MCAPRAEG9wk,314.32,4.48,"for a couple of weeks, but then behind"
MCAPRAEG9wk,316.24,4.04,"my back, she was pushing my boyfriend to"
MCAPRAEG9wk,318.8,3.08,propose.
MCAPRAEG9wk,320.28,3.72,"By this point, we were at the start of"
MCAPRAEG9wk,321.88,4.36,quarantine. His parents were stuck at
MCAPRAEG9wk,324.0,3.68,our house as they couldn't fly home and
MCAPRAEG9wk,326.24,3.68,my boyfriend eventually decided that
MCAPRAEG9wk,327.68,4.04,"instead of telling me this, he went to"
MCAPRAEG9wk,329.92,3.84,his mom who always wore the family
MCAPRAEG9wk,331.72,4.24,engagement ring and asked for it so he
MCAPRAEG9wk,333.76,4.96,could propose. I caught on when
MCAPRAEG9wk,335.96,4.64,mother-in-law accidentally let it slip.
MCAPRAEG9wk,338.72,4.2,I sat my boyfriend down
MCAPRAEG9wk,340.6,4.24,and told me that he knew we just had
MCAPRAEG9wk,342.92,3.52,discussed marriage before and both
MCAPRAEG9wk,344.84,3.16,agreed we were happy
MCAPRAEG9wk,346.44,4.4,and how things were in our relationship
MCAPRAEG9wk,348.0,5.4,"at the moment. He agreed, but told me"
MCAPRAEG9wk,350.84,3.76,what my stepmom told him. I wasn't happy
MCAPRAEG9wk,353.4,3.96,"and after talking to my dad, she"
MCAPRAEG9wk,354.6,4.88,received a massive lecture from him. She
MCAPRAEG9wk,357.36,3.92,called to apologize and to say she was
MCAPRAEG9wk,359.48,4.64,"just looking out for me. I told her,"
MCAPRAEG9wk,361.28,5.88,"""Thank you, but we were fine."" I"
MCAPRAEG9wk,364.12,5.16,definitely kept my guard up after that.
MCAPRAEG9wk,367.16,3.96,We had our son in August and my dad and
MCAPRAEG9wk,369.28,3.92,stepmom stood at the edge of our front
MCAPRAEG9wk,371.12,4.84,porch while we stood by the front door
MCAPRAEG9wk,373.2,4.84,so they could see him. My stepmom kept
MCAPRAEG9wk,375.96,4.08,"trying to come near the baby, which is"
MCAPRAEG9wk,378.04,4.32,where I would step back while my
MCAPRAEG9wk,380.04,4.16,boyfriend would block her while my dad
MCAPRAEG9wk,382.36,3.48,grabbed my stepmom.
MCAPRAEG9wk,384.2,4.16,She kept apologizing saying she kept
MCAPRAEG9wk,385.84,4.48,"forgetting, but for a week after that,"
MCAPRAEG9wk,388.36,3.84,she was constantly texting me every day
MCAPRAEG9wk,390.32,4.36,wanting to see the baby. My dad
MCAPRAEG9wk,392.2,5.36,eventually made her stop after I told
MCAPRAEG9wk,394.68,4.64,him. And I think um the context of this
MCAPRAEG9wk,397.56,4.16,"is like it was really, really early on"
MCAPRAEG9wk,399.32,3.84,in COVID and so they wanted to like keep
MCAPRAEG9wk,401.72,1.92,her and everyone else away from the
MCAPRAEG9wk,403.16,3.28,baby.
MCAPRAEG9wk,403.64,4.6,"Yeah. Wait, and also I I missed this."
MCAPRAEG9wk,406.44,3.24,How old are they now?
MCAPRAEG9wk,408.24,5.28,There's been
MCAPRAEG9wk,409.68,5.68,no mention of ages so far.
MCAPRAEG9wk,413.52,4.36,We saw her on Christmas. She wanted to
MCAPRAEG9wk,415.36,4.76,constantly hold him. Even went into his
MCAPRAEG9wk,417.88,5.28,nursery as he slept and tried to pick
MCAPRAEG9wk,420.12,5.44,him up as he slept. We always saw this
MCAPRAEG9wk,423.16,4.48,on the monitors and yelled up the stairs
MCAPRAEG9wk,425.56,4.0,for her to leave him.
MCAPRAEG9wk,427.64,4.04,This led to a fight and she left with my
MCAPRAEG9wk,429.56,4.2,dad. I know they had a massive fight
MCAPRAEG9wk,431.68,4.48,because dad told me her reaction was
MCAPRAEG9wk,433.76,4.56,something he had never seen. She had a
MCAPRAEG9wk,436.16,4.84,miscarriage before they met and her
MCAPRAEG9wk,438.32,4.44,first marriage fell apart because of it.
MCAPRAEG9wk,441.0,3.84,He thinks this has sparked up old
MCAPRAEG9wk,442.76,3.76,memories for her. He promised to get her
MCAPRAEG9wk,444.84,3.24,some help the moment he got back from
MCAPRAEG9wk,446.52,3.44,his work trip.
MCAPRAEG9wk,448.08,3.44,My boyfriend works with my dad so he
MCAPRAEG9wk,449.96,3.44,"left, too."
MCAPRAEG9wk,451.52,4.4,I've been mostly alone with the baby all
MCAPRAEG9wk,453.4,4.96,"week. Yesterday, my stepmom wanted to"
MCAPRAEG9wk,455.92,4.28,come by to pick up something.
MCAPRAEG9wk,458.36,4.32,I left her alone to get what she needed
MCAPRAEG9wk,460.2,4.32,from my garage. I left my office door
MCAPRAEG9wk,462.68,3.48,open while I worked and could see the
MCAPRAEG9wk,464.52,2.76,baby who was on the floor in the living
MCAPRAEG9wk,466.16,3.84,area.
MCAPRAEG9wk,467.28,5.0,My stepmom was taking forever so I went
MCAPRAEG9wk,470.0,4.64,to check on her. She wasn't out by her
MCAPRAEG9wk,472.28,4.04,car so I took the baby and looked around
MCAPRAEG9wk,474.64,4.32,the house for her.
MCAPRAEG9wk,476.32,4.72,I found her in my son's nursery packing
MCAPRAEG9wk,478.96,4.6,up some of his clothes. I asked her what
MCAPRAEG9wk,481.04,5.12,she was doing and she told me she was
MCAPRAEG9wk,483.56,4.72,taking the baby for a couple days.
MCAPRAEG9wk,486.16,4.12,I told her she didn't ask for permission
MCAPRAEG9wk,488.28,4.08,nor was she taking him.
MCAPRAEG9wk,490.28,5.08,"That's when she got angry, looked"
MCAPRAEG9wk,492.36,7.2,"straight at me and said, ""I don't need"
MCAPRAEG9wk,495.36,6.92,"permission to take my baby."""
MCAPRAEG9wk,499.56,4.32,I told her he wasn't her baby and she
MCAPRAEG9wk,502.28,4.4,needed to leave or else I'd call the
MCAPRAEG9wk,503.88,4.6,police. She continued to pack and
MCAPRAEG9wk,506.68,3.84,ignored me.
MCAPRAEG9wk,508.48,4.36,"So, I went to grab my phone. She then"
MCAPRAEG9wk,510.52,4.72,followed me down the stairs screaming at
MCAPRAEG9wk,512.84,3.84,"me. She was leaving,"
MCAPRAEG9wk,515.24,4.32,but tried to grab my baby in the
MCAPRAEG9wk,516.68,5.039,process. When she realized she wasn't
MCAPRAEG9wk,519.56,4.039,"going to get him, she screamed at me"
MCAPRAEG9wk,521.719,3.441,saying she only wanted to kiss him
MCAPRAEG9wk,523.599,3.721,goodbye before leaving.
MCAPRAEG9wk,525.16,2.76,Okay.
MCAPRAEG9wk,527.32,2.08,I told
MCAPRAEG9wk,527.92,3.08,You're trying to kidnap a baby and then
MCAPRAEG9wk,529.4,3.24,you're mad that they won't let you kiss
MCAPRAEG9wk,531.0,4.12,goodbye.
MCAPRAEG9wk,532.64,4.68,I told my boyfriend and dad and I know
MCAPRAEG9wk,535.12,4.2,things didn't go well for her and my dad
MCAPRAEG9wk,537.32,4.0,because she's now telling me that if I
MCAPRAEG9wk,539.32,4.56,"hadn't gotten pregnant, it wouldn't be"
MCAPRAEG9wk,541.32,3.12,causing problems in her marriage.
MCAPRAEG9wk,543.88,2.96,Yeah.
MCAPRAEG9wk,544.44,4.68,What is wrong with her?
MCAPRAEG9wk,546.84,4.04,This is truly This is mental illness to
MCAPRAEG9wk,549.12,4.64,"me. Like when I first read this one, I'm"
MCAPRAEG9wk,550.88,4.08,"like, this sounds like a serious episode"
MCAPRAEG9wk,553.76,3.48,of like psychosis. This is
MCAPRAEG9wk,554.96,5.16,But how did this happen? Like she
MCAPRAEG9wk,557.24,4.68,I don't know. This just out of
MCAPRAEG9wk,560.12,2.96,How did just that spark it? Like how is
MCAPRAEG9wk,561.92,2.76,there nothing having a baby?
MCAPRAEG9wk,563.08,3.04,I know. Like is Was there any other
MCAPRAEG9wk,564.68,2.88,signs? It sounds like everyone was
MCAPRAEG9wk,566.12,3.04,besties and then this happened.
MCAPRAEG9wk,567.56,3.0,It sounds like the start to a horror
MCAPRAEG9wk,569.16,2.96,film. Honestly.
MCAPRAEG9wk,570.56,4.0,Yeah. This is a horror film. This is
MCAPRAEG9wk,572.12,4.72,reality. Like this is my baby.
MCAPRAEG9wk,574.56,3.28,Yeah. And just packing everything up and
MCAPRAEG9wk,576.84,3.48,running out.
MCAPRAEG9wk,577.84,4.56,"watch Manifest? A little bit, yeah."
MCAPRAEG9wk,580.32,4.32,"Not fully through it. Oh, you have to"
MCAPRAEG9wk,582.4,4.24,get to the end and this will spark some
MCAPRAEG9wk,584.64,3.6,things for some people. Some stuff.
MCAPRAEG9wk,586.64,3.92,"Yeah, some crazy baby stealing"
MCAPRAEG9wk,588.24,5.08,"happening. Yeah, I"
MCAPRAEG9wk,590.56,4.04,I think um there's a couple more stories
MCAPRAEG9wk,593.32,2.4,that we're going to read that are kind
MCAPRAEG9wk,594.6,4.24,"of similar to this, you guys, but I"
MCAPRAEG9wk,595.72,4.96,think there is just something that
MCAPRAEG9wk,598.84,3.04,past traumas
MCAPRAEG9wk,600.68,3.36,and like
MCAPRAEG9wk,601.88,3.44,tension really comes up when people have
MCAPRAEG9wk,604.04,3.76,babies. So crazy.
MCAPRAEG9wk,605.32,3.04,But it like completely took over her.
MCAPRAEG9wk,607.8,2.0,She
MCAPRAEG9wk,608.36,3.72,she was on autopilot.
MCAPRAEG9wk,609.8,4.32,enveloped in this baby now. It's her
MCAPRAEG9wk,612.08,4.52,baby. This is the story though when I
MCAPRAEG9wk,614.12,4.68,"heard the one with Alejandra, I was like"
MCAPRAEG9wk,616.6,3.68,"Ooh, like and a lot of people have"
MCAPRAEG9wk,618.8,3.0,written in since and been like my
MCAPRAEG9wk,620.28,4.76,"parents, I live at home with my parents"
MCAPRAEG9wk,621.8,5.76,and they constantly call my baby
MCAPRAEG9wk,625.04,4.92,their baby and it's almost making me
MCAPRAEG9wk,627.56,2.8,feel like my baby is my sibling. Oh my
MCAPRAEG9wk,629.96,1.8,gosh.
MCAPRAEG9wk,630.36,2.0,Like it's making me feel so weird and
MCAPRAEG9wk,631.76,3.0,uncomfortable.
MCAPRAEG9wk,632.36,4.52,Yeah. And I'm like oh
MCAPRAEG9wk,634.76,3.8,"my god, yeah. Like"
MCAPRAEG9wk,636.88,4.04,language is just like so important and
MCAPRAEG9wk,638.56,4.12,"it's like oh, like my little grand baby."
MCAPRAEG9wk,640.92,3.36,"Like it's just Well, it is kind of weird"
MCAPRAEG9wk,642.68,2.36,too cuz I think about
MCAPRAEG9wk,644.28,3.2,um
MCAPRAEG9wk,645.04,4.56,I mean my sister had my niece at a young
MCAPRAEG9wk,647.48,4.32,age and and she ended up living with us
MCAPRAEG9wk,649.6,4.08,for a little bit. And my mom absolutely
MCAPRAEG9wk,651.8,2.8,was not like this is my child or
MCAPRAEG9wk,653.68,2.2,anything like that.
MCAPRAEG9wk,654.6,2.88,"Yeah. But you know, my mom went into"
MCAPRAEG9wk,655.88,3.88,"like her mom mode, you know, cuz that's"
MCAPRAEG9wk,657.48,3.8,what she's known for her past four kids.
MCAPRAEG9wk,659.76,3.52,So like she would help out and be like
MCAPRAEG9wk,661.28,3.0,"very motherly, you know, to"
MCAPRAEG9wk,663.28,2.64,a grandma role.
MCAPRAEG9wk,664.28,3.28,"yeah, it is a grandma role but we but we"
MCAPRAEG9wk,665.92,3.88,all live together. So I think it just
MCAPRAEG9wk,667.56,4.32,like sometimes it was annoying to my
MCAPRAEG9wk,669.8,4.92,sister because it's like
MCAPRAEG9wk,671.88,5.04,"it's like okay, no your place grandma. I"
MCAPRAEG9wk,674.72,3.88,got I got this.
MCAPRAEG9wk,676.92,3.28,But so I think that can get confusing
MCAPRAEG9wk,678.6,3.12,when you do have a
MCAPRAEG9wk,680.2,3.639,a baby and you're living with your
MCAPRAEG9wk,681.72,3.88,"parents when they're so young, you know."
MCAPRAEG9wk,683.839,2.841,Yeah. Cuz the grandma is it's like they
MCAPRAEG9wk,685.6,3.08,go into like this mode where they're
MCAPRAEG9wk,686.68,3.159,like I'm going to help and take care and
MCAPRAEG9wk,688.68,2.88,all this and like when they're all
MCAPRAEG9wk,689.839,4.481,living together then it can make the
MCAPRAEG9wk,691.56,4.68,"mother be like all right, let's uh"
MCAPRAEG9wk,694.32,4.32,chill out. Yeah.
MCAPRAEG9wk,696.24,4.48,This is definitely not that rational
MCAPRAEG9wk,698.64,3.8,grandparent stepping in behavior though.
MCAPRAEG9wk,700.72,4.36,This is completely
MCAPRAEG9wk,702.44,4.88,completely
MCAPRAEG9wk,705.08,3.88,I just this mental illness. Like this is
MCAPRAEG9wk,707.32,3.72,out of this world
MCAPRAEG9wk,708.96,3.08,"not normal. Yeah, this is some crazy"
MCAPRAEG9wk,711.04,3.2,[ __ ]
MCAPRAEG9wk,712.04,4.4,"Well, I had I had this one thought while"
MCAPRAEG9wk,714.24,3.72,you were talking about this and I don't
MCAPRAEG9wk,716.44,3.12,know
MCAPRAEG9wk,717.96,4.28,or I don't actually think this would be
MCAPRAEG9wk,719.56,5.2,"the case, but like in a crazy world,"
MCAPRAEG9wk,722.24,4.8,what if the stepmom was hooking up with
MCAPRAEG9wk,724.76,3.16,the baby daddy? Still didn't come out of
MCAPRAEG9wk,727.04,2.0,her.
MCAPRAEG9wk,727.92,2.32,"Yeah, but still you're not going to be"
MCAPRAEG9wk,729.04,3.48,like this is mine.
MCAPRAEG9wk,730.24,5.44,"no, I know, but I'm saying"
MCAPRAEG9wk,732.52,6.16,"Wait, it doesn't work like that? What?"
MCAPRAEG9wk,735.68,5.36,"Um no, but I'm just saying that like she"
MCAPRAEG9wk,738.68,3.92,could be so attached potentially to like
MCAPRAEG9wk,741.04,3.6,the baby daddy that she was like this
MCAPRAEG9wk,742.6,4.68,should have been my baby kind of thing.
MCAPRAEG9wk,744.64,4.92,Update. Update. Update. No official
MCAPRAEG9wk,747.28,3.64,update. I'll um
MCAPRAEG9wk,749.56,3.0,I'll read the top comments and then I'll
MCAPRAEG9wk,750.92,3.56,read some top comments or I'll read some
MCAPRAEG9wk,752.56,4.08,comments from OP.
MCAPRAEG9wk,754.48,3.88,"So the top comment, does not seem like"
MCAPRAEG9wk,756.64,3.84,rational behavior at all. Please have a
MCAPRAEG9wk,758.36,3.68,talk with your support system and make
MCAPRAEG9wk,760.48,3.88,sure they all understand that this is
MCAPRAEG9wk,762.04,4.64,serious. You need to protect your family
MCAPRAEG9wk,764.36,5.4,and her husband needs to get her medical
MCAPRAEG9wk,766.68,4.88,attention that she so clearly needs. Be
MCAPRAEG9wk,769.76,4.12,safe.
MCAPRAEG9wk,771.56,3.8,Um Yeah. I'm glad the dad is on the side
MCAPRAEG9wk,773.88,4.4,because what like you know Sometimes
MCAPRAEG9wk,775.36,4.84,"they I know, you're lying. You're wrong."
MCAPRAEG9wk,778.28,5.6,Gaslight. Yeah. Don't support. Pick the
MCAPRAEG9wk,780.2,5.76,wife's side. I completely agree. Like to
MCAPRAEG9wk,783.88,3.8,"have the dad be like no, like get in"
MCAPRAEG9wk,785.96,4.16,line. This isn't normal. Like he's
MCAPRAEG9wk,787.68,4.28,constantly reprimanding her. I think is
MCAPRAEG9wk,790.12,5.36,"very, very, very refreshing."
MCAPRAEG9wk,791.96,5.28,"Yeah, I agree. Um next comment, yikes."
MCAPRAEG9wk,795.48,3.96,You may want to make a police report or
MCAPRAEG9wk,797.24,4.599,have it documented in some way. She also
MCAPRAEG9wk,799.44,5.32,probably should not be left around the
MCAPRAEG9wk,801.839,5.401,baby at all under any circumstances. I'm
MCAPRAEG9wk,804.76,4.16,so sorry you're going through this.
MCAPRAEG9wk,807.24,3.04,"Very, very supportive. Like you might"
MCAPRAEG9wk,808.92,4.04,want to get a restraining order. Your
MCAPRAEG9wk,810.28,4.32,stepmom needs professional help. Because
MCAPRAEG9wk,812.96,4.76,"yeah, this it really does sound like her"
MCAPRAEG9wk,814.6,5.44,miscarriage seriously affected her.
MCAPRAEG9wk,817.72,4.28,Yeah. And it's almost like some PTSD
MCAPRAEG9wk,820.04,3.72,really like coming to light and being
MCAPRAEG9wk,822.0,5.04,triggered.
MCAPRAEG9wk,823.76,5.12,Um so some comments from OP.
MCAPRAEG9wk,827.04,3.72,I know I'm already talking to a lawyer
MCAPRAEG9wk,828.88,3.8,and my in-laws have agreed to go with me
MCAPRAEG9wk,830.76,4.079,to go to the police. I'll be doing that
MCAPRAEG9wk,832.68,3.64,first thing in the morning.
MCAPRAEG9wk,834.839,4.201,Uh Wow.
MCAPRAEG9wk,836.32,2.72,Yeah.
MCAPRAEG9wk,839.08,3.2,"Well, at least she has all the support"
MCAPRAEG9wk,840.68,4.2,around her.
MCAPRAEG9wk,842.28,5.24,"Yeah, but still it's just like forever"
MCAPRAEG9wk,844.88,4.2,now you're just constantly thinking
MCAPRAEG9wk,847.52,3.6,"Well, I have a feeling what's going to"
MCAPRAEG9wk,849.08,4.84,happen is they their marriage might not
MCAPRAEG9wk,851.12,4.8,"work out. Yeah, sorry. But sorry, go on."
MCAPRAEG9wk,853.92,2.44,Constantly thinking what?
MCAPRAEG9wk,855.92,2.88,Justin?
MCAPRAEG9wk,856.36,4.599,"Oh, I don't know. I just like initially"
MCAPRAEG9wk,858.8,3.6,"when it when she was first saying it, I"
MCAPRAEG9wk,860.959,3.12,just thought
MCAPRAEG9wk,862.4,3.76,"if it happens to me, if I'm in that"
MCAPRAEG9wk,864.079,3.521,"situation, I almost think"
MCAPRAEG9wk,866.16,4.16,"when she first says that, you're almost"
MCAPRAEG9wk,867.6,4.08,"kind of like ha, yeah, like okay, nobody"
MCAPRAEG9wk,870.32,3.759,told me and you kind of think it's a
MCAPRAEG9wk,871.68,4.56,"joke Mhm. or something, but then when"
MCAPRAEG9wk,874.079,4.041,"she's like freaking out, then it becomes"
MCAPRAEG9wk,876.24,4.48,scary almost.
MCAPRAEG9wk,878.12,3.04,And then it is the restraining order or
MCAPRAEG9wk,880.72,2.119,Yeah.
MCAPRAEG9wk,881.16,4.52,But it just sucks to even have to
MCAPRAEG9wk,882.839,5.881,involve law enforcement into family
MCAPRAEG9wk,885.68,5.12,matters like that. It's just so weird.
MCAPRAEG9wk,888.72,3.76,"It's very common though. No, I know it"
MCAPRAEG9wk,890.8,4.039,"is. It's so common. No, I'm not saying"
MCAPRAEG9wk,892.48,4.24,it's weird in this like overall. It's
MCAPRAEG9wk,894.839,3.761,"just if you were in that situation, it"
MCAPRAEG9wk,896.72,2.239,just feels very
MCAPRAEG9wk,898.6,1.96,I mean
MCAPRAEG9wk,898.959,3.361,weird to have to call the police on your
MCAPRAEG9wk,900.56,3.96,mother-in-law Yeah.
MCAPRAEG9wk,902.32,4.6,and just go through that cuz then
MCAPRAEG9wk,904.52,3.04,forever that's just kind of a strained
MCAPRAEG9wk,906.92,1.68,It's not ideal.
MCAPRAEG9wk,907.56,3.0,weird relationship you have.
MCAPRAEG9wk,908.6,3.72,It's not ideal and like my family has
MCAPRAEG9wk,910.56,2.8,"gone through some [ __ ] Like my brother,"
MCAPRAEG9wk,912.32,2.6,one of the first times you met my
MCAPRAEG9wk,913.36,5.08,"brother, he talked about like a fight"
MCAPRAEG9wk,914.92,5.2,he'd gotten into with my other siblings
MCAPRAEG9wk,918.44,3.519,biological dad
MCAPRAEG9wk,920.12,3.76,and I don't think the cops were ever
MCAPRAEG9wk,921.959,4.281,"called on that and like my mom, I've"
MCAPRAEG9wk,923.88,4.36,witnessed some like abuse from partners
MCAPRAEG9wk,926.24,3.08,with my mom and like the cops were never
MCAPRAEG9wk,928.24,3.2,"called on that, but like they definitely"
MCAPRAEG9wk,929.32,4.24,should have. So it's like I wish they
MCAPRAEG9wk,931.44,4.04,would have been. But even even though
