video_id,start,duration,text
MCAPRAEG9wk,1884.92,4.48,"away with that? Right, it's never going"
MCAPRAEG9wk,1886.8,5.08,to happen.
MCAPRAEG9wk,1889.4,4.64,Unhinged. There's more kidnapping
MCAPRAEG9wk,1891.88,4.24,stories I found. I'll post the links on
MCAPRAEG9wk,1894.04,4.12,the YouTube description if you guys want
MCAPRAEG9wk,1896.12,3.48,to read them anyways.
MCAPRAEG9wk,1898.16,2.72,But I think I think we're good on the
MCAPRAEG9wk,1899.6,2.0,the kidnappy kid vibes.
MCAPRAEG9wk,1900.88,1.2,Mhm. Yeah.
MCAPRAEG9wk,1901.6,0.72,Right?
MCAPRAEG9wk,1902.08,2.48,Yeah.
MCAPRAEG9wk,1902.32,4.2,"Yeah, yeah. Yeah. Um"
MCAPRAEG9wk,1904.56,3.16,Give us some more diversity. Yeah. It
MCAPRAEG9wk,1906.52,2.64,sounds like all these people got it
MCAPRAEG9wk,1907.72,3.8,figured out.
MCAPRAEG9wk,1909.16,4.32,"Uh luckily, the update on the one where"
MCAPRAEG9wk,1911.52,3.72,the mom stole the key and took the kid
MCAPRAEG9wk,1913.48,4.0,while they were sleeping.
MCAPRAEG9wk,1915.24,4.36,Um they got it all sorted. I'll post
MCAPRAEG9wk,1917.48,4.64,"that update. So,"
MCAPRAEG9wk,1919.6,4.96,"not actual kidnapping, but this one's"
MCAPRAEG9wk,1922.12,4.68,"still a little dicey, okay?"
MCAPRAEG9wk,1924.56,3.96,Am I the [ __ ] for refusing to attend
MCAPRAEG9wk,1926.8,4.56,my brother's wedding after my
MCAPRAEG9wk,1928.52,4.52,sister-in-law left my 2-month-old on a
MCAPRAEG9wk,1931.36,3.4,park bench?
MCAPRAEG9wk,1933.04,4.36,Me and my sister-in-law have always been
MCAPRAEG9wk,1934.76,6.4,close. Her and my brother met when they
MCAPRAEG9wk,1937.4,5.36,were 15. I was 12 and I'm now 21. She
MCAPRAEG9wk,1941.16,3.56,was always really nice to me and we
MCAPRAEG9wk,1942.76,4.08,bonded over the fact that my parents
MCAPRAEG9wk,1944.72,4.48,don't like either of us.
MCAPRAEG9wk,1946.84,3.72,"A few weeks ago, I got called into work"
MCAPRAEG9wk,1949.2,3.08,and my sister-in-law said that I
MCAPRAEG9wk,1950.56,3.08,shouldn't waste money on a babysitter
MCAPRAEG9wk,1952.28,4.84,when I could just let them take her for
MCAPRAEG9wk,1953.64,5.76,a bit. My husband was also at work.
MCAPRAEG9wk,1957.12,5.52,I guess at some point she decided to
MCAPRAEG9wk,1959.4,4.52,take her and her dog for a walk.
MCAPRAEG9wk,1962.64,3.24,She says they were walking through the
MCAPRAEG9wk,1963.92,4.8,park and the leash slipped out of her
MCAPRAEG9wk,1965.88,5.36,"hand. Without thinking, she put my"
MCAPRAEG9wk,1968.72,4.959,daughter on a nearby bench. She was in a
MCAPRAEG9wk,1971.24,3.64,little carrier and she ran after the
MCAPRAEG9wk,1973.679,3.401,dog.
MCAPRAEG9wk,1974.88,5.48,She didn't even catch the dog and it
MCAPRAEG9wk,1977.08,6.76,wasn't until 2 hours later that she even
MCAPRAEG9wk,1980.36,5.6,realized that she was missing.
MCAPRAEG9wk,1983.84,4.08,Okay.
MCAPRAEG9wk,1985.96,4.96,"When I came to pick up my daughter, she"
MCAPRAEG9wk,1987.92,5.72,broke down and told me everything. I was
MCAPRAEG9wk,1990.92,4.24,"livid, but I was so thankful no one"
MCAPRAEG9wk,1993.64,3.64,kidnapped her.
MCAPRAEG9wk,1995.16,4.88,"My husband was so mad, he stormed down"
MCAPRAEG9wk,1997.28,4.52,to their house just to yell at her. Mhm.
MCAPRAEG9wk,2000.04,4.08,She recently messaged me the details
MCAPRAEG9wk,2001.8,3.879,about her wedding. I told her I would
MCAPRAEG9wk,2004.12,4.52,not be attending.
MCAPRAEG9wk,2005.679,6.601,She called me sobbing saying that I am a
MCAPRAEG9wk,2008.64,6.4,petty [ __ ] and she wishes someone would
MCAPRAEG9wk,2012.28,3.68,have kidnapped my daughter. Okay. That's
MCAPRAEG9wk,2015.04,2.76,what she said.
MCAPRAEG9wk,2015.96,3.68,"the decision. Yeah, I was going to say"
MCAPRAEG9wk,2017.8,4.92,like at first I could see just being
MCAPRAEG9wk,2019.64,6.2,"like forgive me, but making that comment"
MCAPRAEG9wk,2022.72,5.76,"like no, [ __ ] you. That is [ __ ] up. I"
MCAPRAEG9wk,2025.84,4.96,hung up on her and she apologized and
MCAPRAEG9wk,2028.48,3.92,said she needs me there.
MCAPRAEG9wk,2030.8,3.44,My friends and family have called me
MCAPRAEG9wk,2032.4,4.92,saying I'm petty and that she was
MCAPRAEG9wk,2034.24,6.32,stressed and it was an accident. Am I
MCAPRAEG9wk,2037.32,4.2,the [ __ ] That's not an accident.
MCAPRAEG9wk,2040.56,5.16,That's not an accident at all.
MCAPRAEG9wk,2041.52,6.12,"love love dogs, love animals. Baby dog,"
MCAPRAEG9wk,2045.72,3.48,2-month-old baby.
MCAPRAEG9wk,2047.64,3.4,Dog.
MCAPRAEG9wk,2049.2,3.84,"Yeah, but even if you set the baby down"
MCAPRAEG9wk,2051.04,3.04,"and 10 seconds later you're like, oh,"
MCAPRAEG9wk,2053.04,3.08,"okay, that was dumb."
MCAPRAEG9wk,2054.08,3.52,she left the baby there for 2 hours?
MCAPRAEG9wk,2056.12,3.559,2 hours.
MCAPRAEG9wk,2057.6,3.0,Yeah. And she didn't find the dog.
MCAPRAEG9wk,2059.679,3.121,Didn't even get the dog.
MCAPRAEG9wk,2060.6,4.0,"No, got so distracted by looking for the"
MCAPRAEG9wk,2062.8,3.24,dog.
MCAPRAEG9wk,2064.6,4.52,Probably.
MCAPRAEG9wk,2066.04,5.72,"Cuz how My god. So, do you want to know"
MCAPRAEG9wk,2069.12,3.16,where this gets worse?
MCAPRAEG9wk,2071.76,2.36,Does it?
MCAPRAEG9wk,2072.28,3.2,Short question. Like can it get worse?
MCAPRAEG9wk,2074.12,3.0,It gets worse.
MCAPRAEG9wk,2075.48,4.679,It gets worse.
MCAPRAEG9wk,2077.12,6.08,"Let me find the comment from OP. So,"
MCAPRAEG9wk,2080.159,5.361,apparently like OP's again very This one
MCAPRAEG9wk,2083.2,4.679,"is very very responsive. She goes,"
MCAPRAEG9wk,2085.52,4.52,"""Kidnapping is quite common in my area,"
MCAPRAEG9wk,2087.879,4.441,"but the park is sort of hidden,"
MCAPRAEG9wk,2090.04,4.879,but still like it's quite common in her
MCAPRAEG9wk,2092.32,4.8,area. Like that is a terrifying thought.
MCAPRAEG9wk,2094.919,4.721,"Oh my god, that's so terrifying. Yeah,"
MCAPRAEG9wk,2097.12,5.36,"playing with fire. So,"
MCAPRAEG9wk,2099.64,5.92,"someone comments and they go,"
MCAPRAEG9wk,2102.48,5.48,"""Yikes. What was she doing for 2 hours"
MCAPRAEG9wk,2105.56,4.48,before she realized she left her on a
MCAPRAEG9wk,2107.96,5.56,bench looking for the dog the whole
MCAPRAEG9wk,2110.04,6.16,"time? Question mark. Not the asshole."""
MCAPRAEG9wk,2113.52,5.16,"And she goes, ""Yeah. She said for about"
MCAPRAEG9wk,2116.2,5.76,40 minutes she was looking for the dog.
MCAPRAEG9wk,2118.68,6.24,Then she told me she went shopping
MCAPRAEG9wk,2121.96,5.0,for clothes for my daughter.
MCAPRAEG9wk,2124.92,4.12,How can you buy clothes for someone and
MCAPRAEG9wk,2126.96,4.08,not realize they were supposed to be
MCAPRAEG9wk,2129.04,4.16,"with you for the last 2 hours?"""
MCAPRAEG9wk,2131.04,3.319,What happened to her?
MCAPRAEG9wk,2133.2,3.32,That's insane.
MCAPRAEG9wk,2134.359,3.881,not even just spacing out or forgetting.
MCAPRAEG9wk,2136.52,2.36,That's just That I don't even know what
MCAPRAEG9wk,2138.24,3.52,that is.
MCAPRAEG9wk,2138.88,3.88,"Yeah, that is crazy. It's like memory"
MCAPRAEG9wk,2141.76,3.04,loss.
MCAPRAEG9wk,2142.76,4.08,Seriously.
MCAPRAEG9wk,2144.8,4.52,I but the thing that the craziest
MCAPRAEG9wk,2146.84,4.519,thought to me about that is is if I was
MCAPRAEG9wk,2149.32,3.52,"the parent,"
MCAPRAEG9wk,2151.359,3.841,I think about the fact that it's so
MCAPRAEG9wk,2152.84,5.56,frustrating that I like when I misplace
MCAPRAEG9wk,2155.2,4.68,"my keys, I can't just like call my keys."
MCAPRAEG9wk,2158.4,3.04,I don't have like a tracker on them. I
MCAPRAEG9wk,2159.88,4.479,can't figure out where they are. If
MCAPRAEG9wk,2161.44,5.72,"someone kidnapped your tiny little baby,"
MCAPRAEG9wk,2164.359,4.241,you can't just like ping it.
MCAPRAEG9wk,2167.16,2.96,"Oh no, you'd be [ __ ]"
MCAPRAEG9wk,2168.6,4.759,what the [ __ ] That is the most
MCAPRAEG9wk,2170.12,5.0,terrifying thing. The I can't I can't
MCAPRAEG9wk,2173.359,3.681,imagine. And like when you trust
MCAPRAEG9wk,2175.12,4.64,somebody to watch your baby to leave
MCAPRAEG9wk,2177.04,4.44,them in a park by themselves for 2
MCAPRAEG9wk,2179.76,3.08,2 hours. What if it was super sunny
MCAPRAEG9wk,2181.48,4.44,outside? That's 2 hours.
MCAPRAEG9wk,2182.84,6.32,was hot and this baby literally [ __ ]
MCAPRAEG9wk,2185.92,4.439,died from the [ __ ] elements.
MCAPRAEG9wk,2189.16,2.24,So scary. Here I go swearing. I was
MCAPRAEG9wk,2190.359,3.921,doing so well.
MCAPRAEG9wk,2191.4,3.88,"No, I [ __ ] swear. But that's I"
MCAPRAEG9wk,2194.28,2.12,thought
MCAPRAEG9wk,2195.28,3.2,But that's the thing.
MCAPRAEG9wk,2196.4,3.08,Bo say that he liked how much I swore?
MCAPRAEG9wk,2198.48,4.04,Yeah.
MCAPRAEG9wk,2199.48,5.52,"Yeah. So, that's the thing. It's like"
MCAPRAEG9wk,2202.52,4.16,What if this little baby 2 hours for a
MCAPRAEG9wk,2205.0,4.4,2-month-old?
MCAPRAEG9wk,2206.68,6.12,2-month-old 2-month-old babies are
MCAPRAEG9wk,2209.4,6.68,They're so little. They're so easily
MCAPRAEG9wk,2212.8,5.96,affected by heat and dehydration.
MCAPRAEG9wk,2216.08,4.32,"So, I'm curious if she realized and then"
MCAPRAEG9wk,2218.76,1.92,went back to the park and found her
MCAPRAEG9wk,2220.4,1.92,there
MCAPRAEG9wk,2220.68,4.0,I was wondering. or if there's actually
MCAPRAEG9wk,2222.32,3.72,other people around cuz if you I mean if
MCAPRAEG9wk,2224.68,3.679,any of us were walking around and you
MCAPRAEG9wk,2226.04,4.24,"see just a random baby on a park bench,"
MCAPRAEG9wk,2228.359,4.241,Yeah. all of us would run up and be
MCAPRAEG9wk,2230.28,3.52,"like, all right, what is going on here?"
MCAPRAEG9wk,2232.6,3.48,Go to the police station.
MCAPRAEG9wk,2233.8,3.32,"Yeah, you figure it out. So, still But"
MCAPRAEG9wk,2236.08,2.4,how do you even figure that out? You
MCAPRAEG9wk,2237.12,2.16,don't have like a name tag on a baby.
MCAPRAEG9wk,2238.48,3.04,You know what I mean?
MCAPRAEG9wk,2239.28,4.0,"Well, still, but at least you know"
MCAPRAEG9wk,2241.52,3.96,so crazy. The idea that like you lose a
MCAPRAEG9wk,2243.28,4.68,"baby, it's like how do people identify?"
MCAPRAEG9wk,2245.48,4.72,It's just at least you know that
MCAPRAEG9wk,2247.96,4.36,you have control of the situation in the
MCAPRAEG9wk,2250.2,4.68,sense that something terrible isn't
MCAPRAEG9wk,2252.32,6.0,going to happen. But this is just crazy.
MCAPRAEG9wk,2254.88,5.68,"Either the park is not very popular,"
MCAPRAEG9wk,2258.32,5.64,but still even you're just tempting
MCAPRAEG9wk,2260.56,5.0,disaster. Yeah. Literally.
MCAPRAEG9wk,2263.96,4.12,"Well, okay, the one thing that I will"
MCAPRAEG9wk,2265.56,6.76,"say is that So, she went back and got"
MCAPRAEG9wk,2268.08,6.88,"the baby before they came home, right?"
MCAPRAEG9wk,2272.32,3.2,"Yeah. So, so she at least she admitted"
MCAPRAEG9wk,2274.96,2.2,to it.
MCAPRAEG9wk,2275.52,3.48,And she did she technically like didn't
MCAPRAEG9wk,2277.16,2.76,"have to say anything, but she she did"
MCAPRAEG9wk,2279.0,4.16,come clean about it.
MCAPRAEG9wk,2279.92,6.4,"I'm like, okay, well, at least she's not"
MCAPRAEG9wk,2283.16,4.0,"Yeah, so OP does go"
MCAPRAEG9wk,2286.32,2.76,That's admirable.
MCAPRAEG9wk,2287.16,3.8,No one picked No one picked the baby up.
MCAPRAEG9wk,2289.08,3.96,No one sat with the baby. The baby was
MCAPRAEG9wk,2290.96,3.72,just sitting there for 2 hours. And so
MCAPRAEG9wk,2293.04,3.48,"OP goes, ""I'm sure that there were a few"
MCAPRAEG9wk,2294.68,3.84,"people in the 2 hours, but no one"
MCAPRAEG9wk,2296.52,4.56,"stopped to get her."" That's crazy."
MCAPRAEG9wk,2298.52,3.92,"If I saw an infant on a bench alone, I'd"
MCAPRAEG9wk,2301.08,3.2,assume its mother was around the park
MCAPRAEG9wk,2302.44,4.56,"somewhere, but I'd still keep an eye on"
MCAPRAEG9wk,2304.28,4.76,it. I think it's very strange how no one
MCAPRAEG9wk,2307.0,5.88,stopped to.
MCAPRAEG9wk,2309.04,5.92,And so she like comments a bunch.
MCAPRAEG9wk,2312.88,4.04,"And so,"
MCAPRAEG9wk,2314.96,4.399,um she basically says luckily it wasn't
MCAPRAEG9wk,2316.92,4.96,"too hot, but she's a little sunburned on"
MCAPRAEG9wk,2319.359,4.281,her arms. We've already taken her to the
MCAPRAEG9wk,2321.88,4.64,doctor/hospital.
MCAPRAEG9wk,2323.64,4.56,They said we shouldn't worry too much.
MCAPRAEG9wk,2326.52,2.839,Um
MCAPRAEG9wk,2328.2,3.28,And a lot of people are just kind of
MCAPRAEG9wk,2329.359,4.281,"like, ""Is your sister-in-law jealous of"
MCAPRAEG9wk,2331.48,3.48,you getting all of this attention
MCAPRAEG9wk,2333.64,2.28,"because you had a baby?"""
MCAPRAEG9wk,2334.96,5.56,it though. It doesn't sound like a
MCAPRAEG9wk,2335.92,6.56,jealousy thing. I don't know. I just Cuz
MCAPRAEG9wk,2340.52,4.16,if it was Why Like why would that be a
MCAPRAEG9wk,2342.48,5.28,jealousy thing? I don't Like I I mean
MCAPRAEG9wk,2344.68,4.08,"she's getting married and you know, she"
MCAPRAEG9wk,2347.76,3.24,her
MCAPRAEG9wk,2348.76,4.08,"sister, future sister-in-law,"
MCAPRAEG9wk,2351.0,3.04,"you know, thinking not thinking from the"
MCAPRAEG9wk,2352.84,2.88,sister-in-law that left the baby's
MCAPRAEG9wk,2354.04,2.92,perspective. It's like I'm getting
MCAPRAEG9wk,2355.72,2.32,married. I want the spotlight to be on
MCAPRAEG9wk,2356.96,2.08,me.
MCAPRAEG9wk,2358.04,2.48,"So, you think she just wanted the"
MCAPRAEG9wk,2359.04,3.88,"attention of being like, ""Look what I"
MCAPRAEG9wk,2360.52,5.36,"did wrong?"""
MCAPRAEG9wk,2362.92,4.56,"No, but I think she like"
MCAPRAEG9wk,2365.88,3.4,I think when people are jealous and
MCAPRAEG9wk,2367.48,3.32,"insecure of themselves, they"
MCAPRAEG9wk,2369.28,3.92,self-sabotage
MCAPRAEG9wk,2370.8,4.24,or they try to hurt those individuals
MCAPRAEG9wk,2373.2,4.24,that they're jealous of.
MCAPRAEG9wk,2375.04,5.0,"Um for example, I read a story today"
MCAPRAEG9wk,2377.44,4.72,about this individual who was insecure
MCAPRAEG9wk,2380.04,4.96,"about their friend,"
MCAPRAEG9wk,2382.16,5.92,had felt threatened by this friend and
MCAPRAEG9wk,2385.0,5.64,"during a test in school, she put"
MCAPRAEG9wk,2388.08,4.64,laxatives in her drink and her sandwich
MCAPRAEG9wk,2390.64,3.6,at lunch to sabotage her friend from
MCAPRAEG9wk,2392.72,2.72,taking the test.
MCAPRAEG9wk,2394.24,3.72,And then if you go look at that person's
MCAPRAEG9wk,2395.44,4.52,"profile, they also admit to crushing up"
MCAPRAEG9wk,2397.96,2.8,sleeping pills and putting them in their
MCAPRAEG9wk,2399.96,3.92,friend's food.
MCAPRAEG9wk,2400.76,5.12,Wow. I think there's unhinged people
MCAPRAEG9wk,2403.88,3.6,that need mental health help. But but
MCAPRAEG9wk,2405.88,3.12,that's the intention. Like that like
MCAPRAEG9wk,2407.48,3.32,they had a result that they were looking
MCAPRAEG9wk,2409.0,2.64,for. Whereas this what result would she
MCAPRAEG9wk,2410.8,2.8,be looking for?
MCAPRAEG9wk,2411.64,4.4,wanted the baby to get kidnapped.
MCAPRAEG9wk,2413.6,4.12,Maybe she wanted to hurt her in a way.
MCAPRAEG9wk,2416.04,3.4,why would she just try again instead of
MCAPRAEG9wk,2417.72,3.24,telling them what she did? I mean she
MCAPRAEG9wk,2419.44,3.04,left that child there for 2 hours and
MCAPRAEG9wk,2420.96,3.48,"went shopping. I know, but I'm just"
MCAPRAEG9wk,2422.48,3.8,saying like why why didn't she like why
MCAPRAEG9wk,2424.44,3.12,would she tell?
MCAPRAEG9wk,2426.28,2.72,"Oh, like why?"
MCAPRAEG9wk,2427.56,3.08,actually acting it out again.
MCAPRAEG9wk,2429.0,3.48,Yeah.
MCAPRAEG9wk,2430.64,4.08,I don't know. So I'm like I like I have
MCAPRAEG9wk,2432.48,4.48,no words for this one. I have no idea.
MCAPRAEG9wk,2434.72,2.8,add up. Like nothing about it adds up.
MCAPRAEG9wk,2436.96,3.84,weird.
MCAPRAEG9wk,2437.52,4.96,fact that when she was confronted by I'm
MCAPRAEG9wk,2440.8,3.44,not going to come to your wedding. And
MCAPRAEG9wk,2442.48,3.44,"she was like, yeah. I wish your baby"
MCAPRAEG9wk,2444.24,3.72,would have been kidnapped. That is some
MCAPRAEG9wk,2445.92,4.48,"crazy [ __ ] Instead of being like, you"
MCAPRAEG9wk,2447.96,3.96,know what? I'm really sorry. I
MCAPRAEG9wk,2450.4,4.04,understand.
MCAPRAEG9wk,2451.92,4.68,I'm hurt. I want you there.
MCAPRAEG9wk,2454.44,4.16,But I understand. Like I say some things
MCAPRAEG9wk,2456.6,4.8,that I don't mean when I'm really hurt.
MCAPRAEG9wk,2458.6,5.16,But like to bring the baby in and say I
MCAPRAEG9wk,2461.4,5.96,wish your baby got kidnapped. That is
MCAPRAEG9wk,2463.76,6.0,not that is not okay. Yeah.
MCAPRAEG9wk,2467.36,4.16,That doesn't surprise me that much. I
MCAPRAEG9wk,2469.76,3.68,and I'm not I don't think leaving the
MCAPRAEG9wk,2471.52,3.2,baby there was malicious. I don't think
MCAPRAEG9wk,2473.44,3.28,that was
MCAPRAEG9wk,2474.72,3.56,for me at least I'm not seeing that as
MCAPRAEG9wk,2476.72,2.68,the intention.
MCAPRAEG9wk,2478.28,3.8,I think
MCAPRAEG9wk,2479.4,5.44,it's just some person who is either very
MCAPRAEG9wk,2482.08,5.48,forgetful or just
MCAPRAEG9wk,2484.84,4.4,just not all there to the point where
MCAPRAEG9wk,2487.56,4.32,you could forget that heavily. You're
MCAPRAEG9wk,2489.24,4.56,distracted by chasing a dog Yeah. that
MCAPRAEG9wk,2491.88,3.08,you make a dumb choice and then realize
MCAPRAEG9wk,2493.8,3.16,it later.
MCAPRAEG9wk,2494.96,4.4,"Right, but even still you could be that"
MCAPRAEG9wk,2496.96,4.32,far removed where you're just like
MCAPRAEG9wk,2499.36,3.76,Then don't just dumb and then Then don't
MCAPRAEG9wk,2501.28,4.08,commit to watching a 2-month-old baby.
MCAPRAEG9wk,2503.12,4.44,Yeah. Right. But but they also wouldn't
MCAPRAEG9wk,2505.36,4.52,be smart enough if they could make these
MCAPRAEG9wk,2507.56,3.16,dumb choices to make that decision on
MCAPRAEG9wk,2509.88,4.28,the front end.
MCAPRAEG9wk,2510.72,4.96,"no. So yes, obviously going forward"
MCAPRAEG9wk,2514.16,3.68,no one's going to trust her with the
MCAPRAEG9wk,2515.68,3.84,"baby, but I don't know. I just don't"
MCAPRAEG9wk,2517.84,5.4,think she left the baby there on
MCAPRAEG9wk,2519.52,6.6,purpose. I I I truly this one has me
MCAPRAEG9wk,2523.24,4.72,very baffled. Same. I don't want to like
MCAPRAEG9wk,2526.12,3.08,think she did it maliciously because how
MCAPRAEG9wk,2527.96,2.76,[ __ ] up is that?
MCAPRAEG9wk,2529.2,4.56,Yeah. Wouldn't that end up couldn't that
MCAPRAEG9wk,2530.72,5.8,end up being like some sort of crime?
MCAPRAEG9wk,2533.76,5.08,Yeah. I like I don't even know if it's I
MCAPRAEG9wk,2536.52,3.84,I think even now she could get charges
MCAPRAEG9wk,2538.84,3.28,pressed against her for neglect.
MCAPRAEG9wk,2540.36,3.48,"Yeah, I was going to say even the the"
MCAPRAEG9wk,2542.12,4.24,"one that you had with Alejandra, the"
MCAPRAEG9wk,2543.84,3.48,story where like the the grandma left
MCAPRAEG9wk,2546.36,2.64,the 2-year-old.
MCAPRAEG9wk,2547.32,3.56,there's reckless endangerment.
MCAPRAEG9wk,2549.0,2.48,"Yeah. And but it was like neglect, too."
MCAPRAEG9wk,2550.88,1.68,Yeah.
MCAPRAEG9wk,2551.48,1.8,She just left the child to go do
MCAPRAEG9wk,2552.56,3.08,laundry.
MCAPRAEG9wk,2553.28,4.04,There's so many crazy laws that I
MCAPRAEG9wk,2555.64,3.16,I mean even lawyers don't know about.
MCAPRAEG9wk,2557.32,3.12,There's so many crazy laws and just
MCAPRAEG9wk,2558.8,2.84,specifics that you could probably press
MCAPRAEG9wk,2560.44,2.56,charges for.
MCAPRAEG9wk,2561.64,2.8,Which she does mention one of her
MCAPRAEG9wk,2563.0,3.04,comments.
MCAPRAEG9wk,2564.44,2.76,"She gives like an update. She's like, I"
MCAPRAEG9wk,2566.04,3.96,didn't think this post would really blow
MCAPRAEG9wk,2567.2,4.44,up. They always say that. I have agreed
MCAPRAEG9wk,2570.0,4.52,to go to the wedding if my brother can
MCAPRAEG9wk,2571.64,4.44,send if my brother chooses to follow
MCAPRAEG9wk,2574.52,2.76,through with the wedding.
MCAPRAEG9wk,2576.08,3.16,My sister and I are trying to convince
MCAPRAEG9wk,2577.28,3.28,him to just reconsider the wedding and
MCAPRAEG9wk,2579.24,3.52,take a second to actually think about
MCAPRAEG9wk,2580.56,4.6,what's happening. I'm seriously thinking
MCAPRAEG9wk,2582.76,3.32,about getting the police involved.
MCAPRAEG9wk,2585.16,1.96,Yeah.
MCAPRAEG9wk,2586.08,3.2,But
MCAPRAEG9wk,2587.12,3.84,so someone made a comment
MCAPRAEG9wk,2589.28,4.56,and this is why I'm like I don't think
MCAPRAEG9wk,2590.96,4.24,there's any health issues involved.
MCAPRAEG9wk,2593.84,2.56,Um but someone made a comment. They're
MCAPRAEG9wk,2595.2,2.72,"like, not the [ __ ] but have you"
MCAPRAEG9wk,2596.4,3.28,talked to your brother about this? Was
MCAPRAEG9wk,2597.92,4.44,he not concerned that his fiance left
MCAPRAEG9wk,2599.68,4.84,his baby niece alone for 2 hours? Right.
MCAPRAEG9wk,2602.36,3.68,Also consider the fact that this isn't
MCAPRAEG9wk,2604.52,3.52,just your sister-in-law's wedding. It's
MCAPRAEG9wk,2606.04,4.8,your brother's wedding. So maybe if you
MCAPRAEG9wk,2608.04,4.84,"want, you can just go in support of your"
MCAPRAEG9wk,2610.84,3.28,"brother, not your sister-in-law. If you"
MCAPRAEG9wk,2612.88,3.24,"don't feel comfortable with that, it's"
MCAPRAEG9wk,2614.12,3.48,perfectly fine because you are entitled
MCAPRAEG9wk,2616.12,3.68,to how you feel.
MCAPRAEG9wk,2617.6,4.68,"And she goes yeah, I talked to my"
MCAPRAEG9wk,2619.8,5.44,"brother and he excused it by saying,"
MCAPRAEG9wk,2622.28,4.48,"quote, she's got diagnosed high blood"
MCAPRAEG9wk,2625.24,2.76,pressure.
MCAPRAEG9wk,2626.76,2.4,Me and my older sister are trying to
MCAPRAEG9wk,2628.0,1.96,talk to him about reconsidering the
MCAPRAEG9wk,2629.16,3.96,engagement.
MCAPRAEG9wk,2629.96,5.6,This is so far just so unrelated and it
MCAPRAEG9wk,2633.12,4.64,"yes, it is a tangent, but"
MCAPRAEG9wk,2635.56,5.56,I feel like
MCAPRAEG9wk,2637.76,5.24,we as people every day make just stupid
MCAPRAEG9wk,2641.12,4.36,mistakes that are pretty forgetful. Like
MCAPRAEG9wk,2643.0,4.32,one time I went to Chipotle and left the
MCAPRAEG9wk,2645.48,3.16,keys in my car with my car running the
MCAPRAEG9wk,2647.32,3.88,whole time I was in there just not
MCAPRAEG9wk,2648.64,4.76,thinking. Mhm. And I came out and I was
MCAPRAEG9wk,2651.2,4.28,"like, what how did this happen? Like how"
MCAPRAEG9wk,2653.4,3.12,did I make this mistake? And you almost
MCAPRAEG9wk,2655.48,2.48,just
MCAPRAEG9wk,2656.52,3.68,you don't even understand what happened.
MCAPRAEG9wk,2657.96,5.04,And I wasn't drunk. I wasn't anything.
MCAPRAEG9wk,2660.2,5.56,Well. And so you just think like
MCAPRAEG9wk,2663.0,3.88,"and yes, a baby is a whole new ballgame."
MCAPRAEG9wk,2665.76,3.76,But
MCAPRAEG9wk,2666.88,5.24,but I think you can still make
MCAPRAEG9wk,2669.52,6.32,"weird forgetful mistakes, especially if"
MCAPRAEG9wk,2672.12,4.64,"you're it it it also isn't her kid, too."
MCAPRAEG9wk,2675.84,2.04,So I can
MCAPRAEG9wk,2676.76,2.04,I don't know. I don't know what I'm
MCAPRAEG9wk,2677.88,3.36,"trying to say, but"
MCAPRAEG9wk,2678.8,5.72,So I have the perfect thing.
MCAPRAEG9wk,2681.24,5.84,I mean in the United States alone
MCAPRAEG9wk,2684.52,4.88,the stats of babies dying in cars every
MCAPRAEG9wk,2687.08,4.4,year is horrendous. Mhm.
MCAPRAEG9wk,2689.4,4.92,I mean parents
MCAPRAEG9wk,2691.48,5.4,and one of the most like tragic pictures
MCAPRAEG9wk,2694.32,5.4,I've ever seen
MCAPRAEG9wk,2696.88,4.92,on the internet was a parent who
MCAPRAEG9wk,2699.72,3.92,left his child in the car
MCAPRAEG9wk,2701.8,3.84,"when he went into work, forgot to drop"
MCAPRAEG9wk,2703.64,4.719,the baby off at daycare and the baby
MCAPRAEG9wk,2705.64,4.84,died in the car. So sad. And it's just
MCAPRAEG9wk,2708.359,3.921,like forgetfulness.
MCAPRAEG9wk,2710.48,4.76,He typically didn't bring the baby to
MCAPRAEG9wk,2712.28,4.88,daycare. His wife did. So he forgot to
MCAPRAEG9wk,2715.24,4.16,drop the baby off. He deviated from his
MCAPRAEG9wk,2717.16,4.28,"routine. It wasn't it you know, he was"
MCAPRAEG9wk,2719.4,3.88,so locked in his patterns and his
MCAPRAEG9wk,2721.44,3.12,"behavior. And it's like you know, for"
MCAPRAEG9wk,2723.28,2.68,"the sister-in-law, she probably doesn't"
MCAPRAEG9wk,2724.56,3.56,watch the baby a lot. The baby's only 2
MCAPRAEG9wk,2725.96,3.44,"months old. So you know, for her her"
MCAPRAEG9wk,2728.12,4.2,pattern and her routine is going to the
MCAPRAEG9wk,2729.4,5.0,park. [ __ ] her dog ran away. I got to
MCAPRAEG9wk,2732.32,3.88,think about the dog. And then it's like
MCAPRAEG9wk,2734.4,2.28,"out of sight, out of mind. That's my"
MCAPRAEG9wk,2736.2,2.72,thought.
MCAPRAEG9wk,2736.68,4.8,I think the confusing thing cuz all of
MCAPRAEG9wk,2738.92,4.8,this I could see it happening. The
MCAPRAEG9wk,2741.48,4.16,confusing thing to me is like how do you
MCAPRAEG9wk,2743.72,3.56,"just lose a dog and you're like, hm I'm"
MCAPRAEG9wk,2745.64,4.52,just going to go shopping now?
MCAPRAEG9wk,2747.28,4.32,"Yeah, did she find the dog? Like"
MCAPRAEG9wk,2750.16,3.24,you said she didn't even find the dog.
MCAPRAEG9wk,2751.6,3.759,So like I would think that if I lost my
MCAPRAEG9wk,2753.4,3.8,dog after 40 minutes of looking for my
MCAPRAEG9wk,2755.359,4.161,"dog, I would be like Sick."
MCAPRAEG9wk,2757.2,4.12,to start making posters. I'm going to go
MCAPRAEG9wk,2759.52,3.76,to like the police or like the the vet
MCAPRAEG9wk,2761.32,3.4,or what what whatever I can do to just
MCAPRAEG9wk,2763.28,3.2,"like be like, hey, this is a picture of"
MCAPRAEG9wk,2764.72,2.96,my dog. Please everyone look for this.
MCAPRAEG9wk,2766.48,3.28,Like the fact that like it was like 40
MCAPRAEG9wk,2767.68,3.6,"minutes and you're like well, time to go"
MCAPRAEG9wk,2769.76,2.12,shopping. That's where I'm kind of
MCAPRAEG9wk,2771.28,2.8,confused.
MCAPRAEG9wk,2771.88,2.56,True. She just seems off. Yeah. She's
MCAPRAEG9wk,2774.08,2.2,off.
MCAPRAEG9wk,2774.44,3.76,Yeah. Um I looked through the comments.
MCAPRAEG9wk,2776.28,3.92,There's no mention of her even finding
MCAPRAEG9wk,2778.2,3.8,the dog. The only comment related to the
MCAPRAEG9wk,2780.2,4.28,"dog was yeah, she said she was looking"
MCAPRAEG9wk,2782.0,3.56,for the dog for about 40 minutes.
MCAPRAEG9wk,2784.48,3.16,So
MCAPRAEG9wk,2785.56,6.76,no idea. Um sounds like this one is
MCAPRAEG9wk,2787.64,6.48,still really developing. Damn.
MCAPRAEG9wk,2792.32,4.039,"Very interesting. Yeah, there's no"
MCAPRAEG9wk,2794.12,4.28,official update yet.
MCAPRAEG9wk,2796.359,4.121,And the last comment was basically we're
MCAPRAEG9wk,2798.4,4.0,trying to get my brother to reconsider.
MCAPRAEG9wk,2800.48,3.6,I would say that that's kind of
