video_id,start,duration,text
MCAPRAEG9wk,4699.88,3.2,promise to wait till she left them
MCAPRAEG9wk,4701.56,3.24,herself.
MCAPRAEG9wk,4703.08,3.28,He nodded but said telling them the
MCAPRAEG9wk,4704.8,3.12,sooner the better.
MCAPRAEG9wk,4706.36,3.16,I told him it was none of his business
MCAPRAEG9wk,4707.92,4.12,and he needed to respect their mother's
MCAPRAEG9wk,4709.52,4.36,wish. He said I could go and he'd watch
MCAPRAEG9wk,4712.04,3.96,the kids.
MCAPRAEG9wk,4713.88,3.92,An hour later my phone rang while I was
MCAPRAEG9wk,4716.0,4.12,with my sister and it was my husband
MCAPRAEG9wk,4717.8,4.28,telling me to get home ASAP because the
MCAPRAEG9wk,4720.12,3.84,kids had a breakdown after he told them
MCAPRAEG9wk,4722.08,4.6,their father passed.
MCAPRAEG9wk,4723.96,4.04,I was dumbfounded and so so mad and
MCAPRAEG9wk,4726.68,3.0,helpless.
MCAPRAEG9wk,4728.0,3.08,I asked why he told them but I couldn't
MCAPRAEG9wk,4729.68,3.8,hear his reply because the kids were
MCAPRAEG9wk,4731.08,4.36,crying loudly in the background.
MCAPRAEG9wk,4733.48,3.4,Their mother heard and figured they
MCAPRAEG9wk,4735.44,3.6,found out.
MCAPRAEG9wk,4736.88,4.0,She told me to drive her to see them. I
MCAPRAEG9wk,4739.04,4.12,apologized for what my husband did but
MCAPRAEG9wk,4740.88,4.52,she didn't respond. We got home and it
MCAPRAEG9wk,4743.16,4.72,was a mess. My heart sank seeing the
MCAPRAEG9wk,4745.4,5.16,kids crying for their dad like that.
MCAPRAEG9wk,4747.88,4.0,Their mom took them inside the room and
MCAPRAEG9wk,4750.56,3.28,shut the door.
MCAPRAEG9wk,4751.88,4.32,I lost it on my husband and he said he
MCAPRAEG9wk,4753.84,3.8,didn't want to say anything. Even made
MCAPRAEG9wk,4756.2,2.88,them breakfast but when he heard the
MCAPRAEG9wk,4757.64,4.68,kids talk about what they were going to
MCAPRAEG9wk,4759.08,5.32,do when they when they see their dad
MCAPRAEG9wk,4762.32,3.76,"he felt the urge to tell them,"
MCAPRAEG9wk,4764.4,3.56,I yelled at him for going against my
MCAPRAEG9wk,4766.08,3.88,sister's wishes.
MCAPRAEG9wk,4767.96,4.16,"He apologized to my sister, but she said"
MCAPRAEG9wk,4769.96,5.32,she doesn't want to see him because the
MCAPRAEG9wk,4772.12,4.72,kids stopped talking from their trauma.
MCAPRAEG9wk,4775.28,3.24,"He wanted to go to the funeral, but I"
MCAPRAEG9wk,4776.84,4.36,told him my sister doesn't want to see
MCAPRAEG9wk,4778.52,4.72,him and I'm respecting her wish.
MCAPRAEG9wk,4781.2,4.68,He got upset saying I excluded him from
MCAPRAEG9wk,4783.24,4.12,"family events, which was unfair and"
MCAPRAEG9wk,4785.88,2.76,flat-out petty.
MCAPRAEG9wk,4787.36,2.92,"He said he couldn't help it, so I"
MCAPRAEG9wk,4788.64,3.6,shouldn't hold him accountable because
MCAPRAEG9wk,4790.28,4.36,it just happened.
MCAPRAEG9wk,4792.24,4.16,But I felt ashamed and a major letdown
MCAPRAEG9wk,4794.64,5.92,from my sister because she stated her
MCAPRAEG9wk,4796.4,4.16,wishes and he didn't respect them.
MCAPRAEG9wk,4800.92,3.84,"Um, he's an [ __ ]"
MCAPRAEG9wk,4802.68,3.72,Huge [ __ ] I want to cry thinking
MCAPRAEG9wk,4804.76,4.52,about that. Like
MCAPRAEG9wk,4806.4,4.84,if I was a mother and
MCAPRAEG9wk,4809.28,4.88,those were my wishes that I wanted to be
MCAPRAEG9wk,4811.24,5.2,"the one to tell my kids that,"
MCAPRAEG9wk,4814.16,4.52,that's just why. Like I don't They're
MCAPRAEG9wk,4816.44,4.84,going to be traumatized. Why? Like why
MCAPRAEG9wk,4818.68,5.12,did he think that was his right?
MCAPRAEG9wk,4821.28,4.48,"Well, it was so explicitly Like she made"
MCAPRAEG9wk,4823.8,3.44,"it so clear, too."
MCAPRAEG9wk,4825.76,2.8,like
MCAPRAEG9wk,4827.24,4.84,"he's trying to be like, ""No, they need"
MCAPRAEG9wk,4828.56,5.48,"to know now."" No, they don't. They're"
MCAPRAEG9wk,4832.08,4.68,"When a kid is that little, they're going"
MCAPRAEG9wk,4834.04,4.92,to remember who they were with and how
MCAPRAEG9wk,4836.76,5.28,they were told.
MCAPRAEG9wk,4838.96,5.24,"Oh, I just like just picture them."
MCAPRAEG9wk,4842.04,5.08,Picture them over breakfast.
MCAPRAEG9wk,4844.2,6.48,I just can't wait until dad's not sick
MCAPRAEG9wk,4847.12,5.8,"and we can go to the lake. And he goes,"
MCAPRAEG9wk,4850.68,2.84,"""Well, actually, your dad died this"
MCAPRAEG9wk,4852.92,1.24,"morning."""
MCAPRAEG9wk,4853.52,2.12,"Yeah, literally."
MCAPRAEG9wk,4854.16,3.36,believe he would decide
MCAPRAEG9wk,4855.64,3.04,"going to be going to the lake."" How"
MCAPRAEG9wk,4857.52,3.36,could he decide that was his
MCAPRAEG9wk,4858.68,3.36,responsibility and his place? Like that
MCAPRAEG9wk,4860.88,3.92,is
MCAPRAEG9wk,4862.04,5.68,"so sad. No, and then him being like,"
MCAPRAEG9wk,4864.8,6.16,"""You excluded me from a family thing."""
MCAPRAEG9wk,4867.72,6.08,You [ __ ] lost any rights to be around
MCAPRAEG9wk,4870.96,5.08,that family the minute that you [ __ ]
MCAPRAEG9wk,4873.8,4.8,their life upside down.
MCAPRAEG9wk,4876.04,5.08,You went against her wishes.
MCAPRAEG9wk,4878.6,4.56,You ruined those kids'
MCAPRAEG9wk,4881.12,3.36,moment of grief that they should have
MCAPRAEG9wk,4883.16,1.76,shared with their mom.
MCAPRAEG9wk,4884.48,1.24,Exactly.
MCAPRAEG9wk,4884.92,2.6,Their mom.
MCAPRAEG9wk,4885.72,3.2,Their mom should have been there. The
MCAPRAEG9wk,4887.52,3.16,fact that they found out and they're
MCAPRAEG9wk,4888.92,3.28,"bawling without their mom there, that"
MCAPRAEG9wk,4890.68,3.72,makes me sick to my stomach.
MCAPRAEG9wk,4892.2,5.6,How old are they again? Four and six.
MCAPRAEG9wk,4894.4,4.48,six. They're babies. They're [ __ ]
MCAPRAEG9wk,4897.8,3.0,babies.
MCAPRAEG9wk,4898.88,3.4,I They don't know what's going on. They
MCAPRAEG9wk,4900.8,3.2,need to be with their mom.
MCAPRAEG9wk,4902.28,3.8,What What it was wrong with him? Like if
MCAPRAEG9wk,4904.0,3.76,it was if it wasn't made clear
MCAPRAEG9wk,4906.08,2.92,"beforehand, I would be like it was a"
MCAPRAEG9wk,4907.76,3.04,mistake. Like he thought he was doing
MCAPRAEG9wk,4909.0,4.04,the right thing. He's being honest. But
MCAPRAEG9wk,4910.8,5.52,it was very clear beforehand.
MCAPRAEG9wk,4913.04,4.68,them. And what did he say to He was like
MCAPRAEG9wk,4916.32,4.24,"He literally was like, ""I feel like they"
MCAPRAEG9wk,4917.72,4.6,"need to know."" Well, it I feel like I'm"
MCAPRAEG9wk,4920.56,3.52,such I feel like I'm just the biggest
MCAPRAEG9wk,4922.32,4.2,trust guy ever because all of these
MCAPRAEG9wk,4924.08,5.0,"issues I always go to trust, but"
MCAPRAEG9wk,4926.52,4.56,from you literally now can't trust him.
MCAPRAEG9wk,4929.08,4.56,You asked him to do something
MCAPRAEG9wk,4931.08,4.4,and you trusted him to not do something.
MCAPRAEG9wk,4933.64,3.56,And it's a huge thing. That's And
MCAPRAEG9wk,4935.48,4.24,especially when we're talking about like
MCAPRAEG9wk,4937.2,5.76,how much childhood moments like that
MCAPRAEG9wk,4939.72,3.76,really make an impact on you as a human.
MCAPRAEG9wk,4942.96,2.28,us.
MCAPRAEG9wk,4943.48,5.52,They really do. So like
MCAPRAEG9wk,4945.24,6.24,those things are huge. Like huge. And
MCAPRAEG9wk,4949.0,4.28,"yes, I I I have faith that the kids will"
MCAPRAEG9wk,4951.48,4.28,"be able to, you know, get over that and"
MCAPRAEG9wk,4953.28,3.68,"live a happy life, but I mean that that"
MCAPRAEG9wk,4955.76,3.0,"moment, obviously it's going to take a"
MCAPRAEG9wk,4956.96,3.64,lot to like Time.
MCAPRAEG9wk,4958.76,4.48,"that their dad passed away, but like"
MCAPRAEG9wk,4960.6,4.44,"Therapy. But hearing it from him, I'm"
MCAPRAEG9wk,4963.24,4.64,"sure that they'll get, you know, they'll"
MCAPRAEG9wk,4965.04,5.52,"move on from it, but that he just added"
MCAPRAEG9wk,4967.88,5.2,a difficulty that was so unnecessary and
MCAPRAEG9wk,4970.56,4.44,not his place and so [ __ ] up. This
MCAPRAEG9wk,4973.08,3.4,like makes me scared to let anyone watch
MCAPRAEG9wk,4975.0,3.2,"my kids, honestly."
MCAPRAEG9wk,4976.48,2.4,kind of feels like he didn't care.
MCAPRAEG9wk,4978.2,2.76,Exactly.
MCAPRAEG9wk,4978.88,3.52,It It feels like it didn't feel that big
MCAPRAEG9wk,4980.96,3.64,"to him where he's just like, ""Oh, guess"
MCAPRAEG9wk,4982.4,3.44,"what?"" Or like it was exciting news that"
MCAPRAEG9wk,4984.6,1.68,he wanted to be the one to like break
MCAPRAEG9wk,4985.84,2.6,it.
MCAPRAEG9wk,4986.28,4.68,"Yeah, it's very weird. I I would be the"
MCAPRAEG9wk,4988.44,4.24,exact same way if I was that person's
MCAPRAEG9wk,4990.96,3.8,"significant other. I would be like, ""I"
MCAPRAEG9wk,4992.68,3.28,don't know if I want you to around any
MCAPRAEG9wk,4994.76,2.56,of these people anymore and I don't even
MCAPRAEG9wk,4995.96,4.92,know if I want to be around you because
MCAPRAEG9wk,4997.32,5.4,like that that was a huge breach that
MCAPRAEG9wk,5000.88,3.68,you did. That wasn't something small.
MCAPRAEG9wk,5002.72,4.72,"No, and I'm"
MCAPRAEG9wk,5004.56,4.08,"I know I'm quick to be like divorce,"
MCAPRAEG9wk,5007.44,1.96,"break up,"
MCAPRAEG9wk,5008.64,3.28,but this
MCAPRAEG9wk,5009.4,4.48,our first review in the podcast.
MCAPRAEG9wk,5011.92,4.12,But I These girls just say divorce and
MCAPRAEG9wk,5013.88,4.0,"we're like, ""Well, yeah, we're not I"
MCAPRAEG9wk,5016.04,3.32,"mean, so it's easy. And this is not my"
MCAPRAEG9wk,5017.88,2.36,"relationship, so obviously I'm not"
MCAPRAEG9wk,5019.36,3.88,attached to it.
MCAPRAEG9wk,5020.24,4.44,Yeah. But I just look at this as if my
MCAPRAEG9wk,5023.24,4.44,partner
MCAPRAEG9wk,5024.68,5.56,"would have violated my trust, gone"
MCAPRAEG9wk,5027.68,6.24,"against my wishes, disrespected me,"
MCAPRAEG9wk,5030.24,6.12,"disrespected my family, traumatized my"
MCAPRAEG9wk,5033.92,3.88,niece and nephew. I just like I look at
MCAPRAEG9wk,5036.36,3.56,all of this and I'm like add all of this
MCAPRAEG9wk,5037.8,4.84,combined and then the fact he's
MCAPRAEG9wk,5039.92,4.92,"whimpering and oh, Yeah, now he's the"
MCAPRAEG9wk,5042.64,4.84,"victim. Also him being like, ""You're"
MCAPRAEG9wk,5044.84,6.12,"excluding me from a family event."" This"
MCAPRAEG9wk,5047.48,6.56,is [ __ ] a funeral. This is not a
MCAPRAEG9wk,5050.96,5.12,[ __ ] holiday party celebration.
MCAPRAEG9wk,5054.04,5.0,You're being excluded from a funeral
MCAPRAEG9wk,5056.08,5.12,because you just ruined that kid those
MCAPRAEG9wk,5059.04,4.8,kids' grieving process. He's playing
MCAPRAEG9wk,5061.2,3.68,victim. I'm looking at this person and
MCAPRAEG9wk,5063.84,3.04,"I'm like,"
MCAPRAEG9wk,5064.88,3.4,"""Let's add up all the reasons why you're"
MCAPRAEG9wk,5066.88,2.52,"an asshole."" Yeah."
MCAPRAEG9wk,5068.28,4.36,"And I'm like,"
MCAPRAEG9wk,5069.4,6.52,"""Do I want to be with this person?"""
MCAPRAEG9wk,5072.64,5.32,"Yeah, so it's It reminds me of the the"
MCAPRAEG9wk,5075.92,3.96,lady who threw away all the pictures of
MCAPRAEG9wk,5077.96,4.84,the late mom.
MCAPRAEG9wk,5079.88,4.32,He ruined this like It's the same [ __ ]
MCAPRAEG9wk,5082.8,4.48,And I look at I didn't watch that
MCAPRAEG9wk,5084.2,4.6,episode yet. I look at how traumatic
MCAPRAEG9wk,5087.28,2.96,death is. Like
MCAPRAEG9wk,5088.8,5.2,I
MCAPRAEG9wk,5090.24,7.88,I'm so [ __ ] in the head. Like I'm so
MCAPRAEG9wk,5094.0,5.52,scared of losing my dad that I literally
MCAPRAEG9wk,5098.12,3.12,go and check and make sure he's
MCAPRAEG9wk,5099.52,3.8,breathing
MCAPRAEG9wk,5101.24,5.76,when I wake up in the morning and he's
MCAPRAEG9wk,5103.32,5.56,not gone before me. Like I'm terrorized
MCAPRAEG9wk,5107.0,3.08,of losing a parent. So like I can't even
MCAPRAEG9wk,5108.88,3.12,imagine these four and five-year-old
MCAPRAEG9wk,5110.08,5.32,kids who are just like just beginning
MCAPRAEG9wk,5112.0,5.12,their little lives and just
MCAPRAEG9wk,5115.4,3.28,[ __ ] Absolute [ __ ] of the day.
MCAPRAEG9wk,5117.12,3.48,"Yeah, I completely agree."
MCAPRAEG9wk,5118.68,3.88,He is the [ __ ] She is not the
MCAPRAEG9wk,5120.6,4.04,[ __ ] for not taking him to the
MCAPRAEG9wk,5122.56,5.24,"funeral. Uh, yeah. Uh, which leads into"
MCAPRAEG9wk,5124.64,5.08,"the Actually, there was a mod uh that"
MCAPRAEG9wk,5127.8,3.48,"stickied the comment, so it's at the top"
MCAPRAEG9wk,5129.72,3.16,"Yeah. saying, ""All right, folks, it's"
MCAPRAEG9wk,5131.28,4.2,that time of day again where we remind
MCAPRAEG9wk,5132.88,3.24,"you to be civil."" Yeah, good luck on"
MCAPRAEG9wk,5135.48,2.76,this one.
MCAPRAEG9wk,5136.12,4.92,"one got pretty heated. Uh,"
MCAPRAEG9wk,5138.24,4.92,top comment has a lot of awards.
MCAPRAEG9wk,5141.04,4.16,"Uh, not the [ __ ] I was babysitting"
MCAPRAEG9wk,5143.16,3.64,for a family friend while they were at
MCAPRAEG9wk,5145.2,4.28,the hospital saying goodbye to their
MCAPRAEG9wk,5146.8,4.8,other child. Oh. I knew that their son
MCAPRAEG9wk,5149.48,3.68,"had died, but I kept my mouth shut and"
MCAPRAEG9wk,5151.6,3.88,loved on their daughter who was talking
MCAPRAEG9wk,5153.16,4.48,about going to see her brother until
MCAPRAEG9wk,5155.48,2.96,they got home because it was
MCAPRAEG9wk,5157.64,2.88,going to cry.
MCAPRAEG9wk,5158.44,4.88,because it was 1 million percent not my
MCAPRAEG9wk,5160.52,4.92,place to say anything. Didn't even cross
MCAPRAEG9wk,5163.32,4.44,"my mind to tell her, even though I had"
MCAPRAEG9wk,5165.44,5.36,to leave the room a few times to wipe my
MCAPRAEG9wk,5167.76,5.56,eyes and regain composure.
MCAPRAEG9wk,5170.8,2.92,"Yeah, okay."
MCAPRAEG9wk,5173.32,3.84,Oh.
MCAPRAEG9wk,5173.72,5.92,"So But yeah, it's it's 100%"
MCAPRAEG9wk,5177.16,3.64,not your [ __ ] place to tell. He's an
MCAPRAEG9wk,5179.64,2.48,adult.
MCAPRAEG9wk,5180.8,3.0,If you need to go in the other room and
MCAPRAEG9wk,5182.12,3.04,"step back, like yeah, you just lost your"
MCAPRAEG9wk,5183.8,5.04,brother-in-law.
MCAPRAEG9wk,5185.16,5.88,Yeah. Step back. Like Step back. This is
MCAPRAEG9wk,5188.84,5.72,"not your place, though."
MCAPRAEG9wk,5191.04,5.52,I don't understand in what rational mind
MCAPRAEG9wk,5194.56,5.12,"Mhm. Well, and this is interesting."
MCAPRAEG9wk,5196.56,4.96,Exactly. Children that young are easily
MCAPRAEG9wk,5199.68,3.52,distracted as well. He really could have
MCAPRAEG9wk,5201.52,4.04,thrown on the TV for a few hours until
MCAPRAEG9wk,5203.2,4.4,"their mom came. No, he totally wanted to"
MCAPRAEG9wk,5205.56,4.4,hurt those kids by telling them. They
MCAPRAEG9wk,5207.6,5.16,were distracted. It almost seems like he
MCAPRAEG9wk,5209.96,3.48,wanted to just like have the spotlight.
MCAPRAEG9wk,5212.76,2.72,Like yes.
MCAPRAEG9wk,5213.44,3.48,"Like have the power. Like just like,"
MCAPRAEG9wk,5215.48,3.04,"""Oh, I know this news. I'm going to let"
MCAPRAEG9wk,5216.92,3.72,you guys know. Like I want to be the
MCAPRAEG9wk,5218.52,4.16,"first to let you Like I don't know, but"
MCAPRAEG9wk,5220.64,3.12,like it makes me so sick.
MCAPRAEG9wk,5222.68,3.52,He's unhinged.
MCAPRAEG9wk,5223.76,4.12,"And again again, obviously I don't know"
MCAPRAEG9wk,5226.2,4.56,like we're not hearing him talk. We are
MCAPRAEG9wk,5227.88,5.32,"not hearing like his situation, but like"
MCAPRAEG9wk,5230.76,2.76,"from what we do know, this is sick."
MCAPRAEG9wk,5233.2,2.32,Yeah.
MCAPRAEG9wk,5233.52,3.96,It makes me so sad.
MCAPRAEG9wk,5235.52,4.08,And I get every situation is so
MCAPRAEG9wk,5237.48,3.96,subjected to the person that experiences
MCAPRAEG9wk,5239.6,4.28,it. Like obviously OP writing in is the
MCAPRAEG9wk,5241.44,4.84,wife in this situation. But there's very
MCAPRAEG9wk,5243.88,4.72,objective information here.
MCAPRAEG9wk,5246.28,5.32,"It was expressly said,"
MCAPRAEG9wk,5248.6,5.52,"""Don't tell the kids."" And he still went"
MCAPRAEG9wk,5251.6,4.64,against that and told the kids. Yeah.
MCAPRAEG9wk,5254.12,4.76,So no matter what else went on in the
MCAPRAEG9wk,5256.24,3.12,"situation, he had one [ __ ]"
MCAPRAEG9wk,5258.88,1.96,I agree.
MCAPRAEG9wk,5259.36,5.04,one [ __ ] assignment.
MCAPRAEG9wk,5260.84,5.84,one job. He did not understand
MCAPRAEG9wk,5264.4,3.52,for you guys. the assignment.
MCAPRAEG9wk,5266.68,4.32,"Well, and the other way to think about"
MCAPRAEG9wk,5267.92,5.0,it that you kind of lately touched on is
MCAPRAEG9wk,5271.0,3.44,now the kids forever have this memory
MCAPRAEG9wk,5272.92,3.56,with him.
MCAPRAEG9wk,5274.44,3.279,These kids have not spoken. That's the
MCAPRAEG9wk,5276.48,4.72,whole reason he's not invited to the
MCAPRAEG9wk,5277.719,5.681,"funeral, too. Like one, he disobeyed"
MCAPRAEG9wk,5281.2,4.36,"all guidelines, did not understand the"
MCAPRAEG9wk,5283.4,4.92,"assignment, but these kids have now gone"
MCAPRAEG9wk,5285.56,3.6,"like mute, right? They did They did"
MCAPRAEG9wk,5288.32,1.52,write that that they haven't been
MCAPRAEG9wk,5289.16,2.36,talking.
MCAPRAEG9wk,5289.84,4.52,been talking. These kids have now
MCAPRAEG9wk,5291.52,4.56,because of this trauma and this sadness
MCAPRAEG9wk,5294.36,3.16,have decided not to talk.
MCAPRAEG9wk,5296.08,3.4,"Yeah, the kids stopped talking from"
MCAPRAEG9wk,5297.52,4.16,their trauma.
MCAPRAEG9wk,5299.48,4.239,It makes me so sick. And And I think the
MCAPRAEG9wk,5301.68,3.88,reason it makes me so so so sick is that
MCAPRAEG9wk,5303.719,3.881,I'm assuming that this guy is like very
MCAPRAEG9wk,5305.56,3.2,like in his right mind and very level.
MCAPRAEG9wk,5307.6,4.68,Normal. And like
MCAPRAEG9wk,5308.76,6.28,"Not on does not have any diagnoses, is"
MCAPRAEG9wk,5312.28,4.439,"just a normal dude. Not taking drugs,"
MCAPRAEG9wk,5315.04,4.44,like not like out of this world. Like
MCAPRAEG9wk,5316.719,5.681,I'm assuming these things and so Right.
MCAPRAEG9wk,5319.48,4.68,"makes me so sick because I'm like, ""Who"
MCAPRAEG9wk,5322.4,2.88,in their rational right mind? Like who
MCAPRAEG9wk,5324.16,2.72,"do you think you are?"""
MCAPRAEG9wk,5325.28,4.56,"Well, and for kids this young"
MCAPRAEG9wk,5326.88,4.52,Entitlement. But kids this young to stop
MCAPRAEG9wk,5329.84,4.04,talking?
MCAPRAEG9wk,5331.4,5.76,Four and five. Four and six. Like make
MCAPRAEG9wk,5333.88,5.68,that making that choice at that age to
MCAPRAEG9wk,5337.16,4.88,"be like, Ugh. Well, I just if someone"
MCAPRAEG9wk,5339.56,4.76,random like to me like random I mean not
MCAPRAEG9wk,5342.04,5.32,"super random, but like that's just"
MCAPRAEG9wk,5344.32,5.96,not my my home is telling me that
MCAPRAEG9wk,5347.36,3.8,someone that I love most in the entire
MCAPRAEG9wk,5350.28,3.2,universe
MCAPRAEG9wk,5351.16,4.76,You also like don't believe it. There's
MCAPRAEG9wk,5353.48,4.72,It's just so sickening to me. Like it
MCAPRAEG9wk,5355.92,5.8,wasn't his place. Like I want to scream
MCAPRAEG9wk,5358.2,5.76,at this man. I want to kill him.
MCAPRAEG9wk,5361.72,5.36,I think there's something though where
MCAPRAEG9wk,5363.96,5.28,"the younger you are that trauma occurs,"
MCAPRAEG9wk,5367.08,3.36,the more likely you are to actually stop
MCAPRAEG9wk,5369.24,2.88,talking.
MCAPRAEG9wk,5370.44,3.28,And this is something I definitely am
MCAPRAEG9wk,5372.12,3.52,going to fact-check. I like really want
MCAPRAEG9wk,5373.72,4.04,to look this up where
MCAPRAEG9wk,5375.64,4.36,um to make sure like this is actually a
MCAPRAEG9wk,5377.76,4.2,"thing, but I think the younger trauma"
MCAPRAEG9wk,5380.0,3.56,happens at the more likely someone is to
MCAPRAEG9wk,5381.96,3.12,like stop talking or shut down.
MCAPRAEG9wk,5383.56,4.0,Interesting. I need to see the
MCAPRAEG9wk,5385.08,3.48,fact-check. That's interesting though
MCAPRAEG9wk,5387.56,2.72,cuz I
MCAPRAEG9wk,5388.56,3.56,my first thought was that the younger
MCAPRAEG9wk,5390.28,4.6,you are the more likely you'd be to
MCAPRAEG9wk,5392.12,4.32,continually just ask out questions and
MCAPRAEG9wk,5394.88,5.0,try to understand because you've never
MCAPRAEG9wk,5396.44,5.0,experienced these concepts.
MCAPRAEG9wk,5399.88,3.48,And I think it's like
MCAPRAEG9wk,5401.44,3.84,exactly what you're saying
MCAPRAEG9wk,5403.36,3.72,but flip it. You've never experienced
MCAPRAEG9wk,5405.28,3.84,"these concepts, so you don't know how to"
MCAPRAEG9wk,5407.08,4.24,"deal with it, so you shut down. But I"
MCAPRAEG9wk,5409.12,4.72,also think though too at an older age
MCAPRAEG9wk,5411.32,5.96,you could shut down just because
MCAPRAEG9wk,5413.84,5.8,you do understand what has truly
MCAPRAEG9wk,5417.28,3.72,happened and you just
MCAPRAEG9wk,5419.64,5.44,shut down. Yeah.
MCAPRAEG9wk,5421.0,5.44,know. It's called selective mutism.
MCAPRAEG9wk,5425.08,3.08,And obviously this is like a very
MCAPRAEG9wk,5426.44,3.68,specific
MCAPRAEG9wk,5428.16,3.12,circumstance.
MCAPRAEG9wk,5430.12,4.12,"So, I'm not even sure if I'm going to"
MCAPRAEG9wk,5431.28,4.04,find anything like directly on this.
MCAPRAEG9wk,5434.24,2.96,Yeah.
MCAPRAEG9wk,5435.32,4.48,"So,"
MCAPRAEG9wk,5437.2,4.4,"there's not a lot on this, but there's"
MCAPRAEG9wk,5439.8,3.92,"So, this one quote, there's also a"
MCAPRAEG9wk,5441.6,5.12,misconception that kids who can't speak
MCAPRAEG9wk,5443.72,6.32,in some settings have been traumatized.
MCAPRAEG9wk,5446.72,6.84,"In fact, kids who become mute after a"
MCAPRAEG9wk,5450.04,5.72,traumatic experience are typically mute
MCAPRAEG9wk,5453.56,5.28,"in all situations,"
MCAPRAEG9wk,5455.76,4.2,not specific social environments.
MCAPRAEG9wk,5458.84,4.32,"So,"
MCAPRAEG9wk,5459.96,6.04,these kids literally could be affected
MCAPRAEG9wk,5463.16,5.48,pretty greatly in all areas of their
MCAPRAEG9wk,5466.0,5.56,life going forward because of the fact
MCAPRAEG9wk,5468.64,5.2,that this man took it into his own hands
MCAPRAEG9wk,5471.56,5.76,and thought it was his [ __ ]
MCAPRAEG9wk,5473.84,4.92,"job, his due diligence to tell these"
MCAPRAEG9wk,5477.32,4.04,poor children.
MCAPRAEG9wk,5478.76,3.56,Makes me so mad.
MCAPRAEG9wk,5481.36,3.2,Yeah.
MCAPRAEG9wk,5482.32,5.84,There's not a lot on this either like
MCAPRAEG9wk,5484.56,5.68,selective mutism after trauma.
MCAPRAEG9wk,5488.16,3.12,There's not
MCAPRAEG9wk,5490.24,1.84,I wish people
MCAPRAEG9wk,5491.28,2.56,a lot on it.
MCAPRAEG9wk,5492.08,5.16,There's so many things through growing
MCAPRAEG9wk,5493.84,6.08,up that I now look back and I'm like
MCAPRAEG9wk,5497.24,5.2,I learned so much in school about things
MCAPRAEG9wk,5499.92,4.2,that are just not relevant to me today
MCAPRAEG9wk,5502.44,3.44,and I don't regret learning those things
MCAPRAEG9wk,5504.12,2.76,cuz I think they help with your brain
MCAPRAEG9wk,5505.88,3.88,like
MCAPRAEG9wk,5506.88,5.6,developing and understanding just I
MCAPRAEG9wk,5509.76,4.24,don't I don't even know. But but what
MCAPRAEG9wk,5512.48,3.88,makes me mad is that there's so many
MCAPRAEG9wk,5514.0,4.88,things that we can learn. I I still feel
MCAPRAEG9wk,5516.36,5.08,like there should be more communication
MCAPRAEG9wk,5518.88,4.84,for people to really understand how
MCAPRAEG9wk,5521.44,3.56,these things can have an impact because
MCAPRAEG9wk,5523.72,5.2,I don't know I think that even like with
MCAPRAEG9wk,5525.0,7.32,myself like my mom loves me so much and
MCAPRAEG9wk,5528.92,5.04,I love my mom so much and then I still
MCAPRAEG9wk,5532.32,3.88,think some of these things that happen
MCAPRAEG9wk,5533.96,4.76,like in my childhood like where you know
MCAPRAEG9wk,5536.2,4.8,she wasn't trying to be mean at all like
MCAPRAEG9wk,5538.72,4.76,or bad or anything.
MCAPRAEG9wk,5541.0,4.96,"Like, she was a great mom to me, but I"
MCAPRAEG9wk,5543.48,4.6,think that some of these things have an
MCAPRAEG9wk,5545.96,4.8,impact on who I am. 100%.
MCAPRAEG9wk,5548.08,4.16,"And like we just don't No one No Yeah,"
MCAPRAEG9wk,5550.76,3.28,no one knows that. Like
MCAPRAEG9wk,5552.24,5.08,"Well, it's it's nature versus nurture."
MCAPRAEG9wk,5554.04,5.32,We are we are a sum of our environment.
MCAPRAEG9wk,5557.32,4.84,"I think biology plays a big part, but I"
MCAPRAEG9wk,5559.36,3.76,also think we are heavily shaped by our
MCAPRAEG9wk,5562.16,2.36,experiences.
MCAPRAEG9wk,5563.12,2.96,Yeah.
MCAPRAEG9wk,5564.52,4.72,And I'm starting to realizing more and
MCAPRAEG9wk,5566.08,4.88,more like these certain instances as a
MCAPRAEG9wk,5569.24,3.8,kid. I'm starting to remember these
MCAPRAEG9wk,5570.96,3.96,times where it's like no one was
MCAPRAEG9wk,5573.04,4.2,outright like trying to like hurt me or
MCAPRAEG9wk,5574.92,5.0,"be mean to me, but these things made me"
MCAPRAEG9wk,5577.24,5.28,feel a certain way that is like shaped
MCAPRAEG9wk,5579.92,4.56,who I am now. Yeah.
MCAPRAEG9wk,5582.52,4.08,It's just crazy. I don't know I just
MCAPRAEG9wk,5584.48,4.76,think it should be more of a topic.
MCAPRAEG9wk,5586.6,6.0,"So, back to the story."
MCAPRAEG9wk,5589.24,5.28,There's not a update.
MCAPRAEG9wk,5592.6,4.68,Uh did you realize this was posted 1 day
MCAPRAEG9wk,5594.52,6.0,"ago? No, but I did look for the update."
MCAPRAEG9wk,5597.28,7.44,"Yeah, this was posted 1 day ago. So,"
MCAPRAEG9wk,5600.52,6.76,Update to come. Very very fresh. We will
MCAPRAEG9wk,5604.72,6.88,keep our eyes peeled for an update.
MCAPRAEG9wk,5607.28,6.24,OP only replies to
MCAPRAEG9wk,5611.6,3.96,one comment
MCAPRAEG9wk,5613.52,4.4,and it is this.
MCAPRAEG9wk,5615.56,3.76,"Comment says, ""Not the [ __ ] at all."
MCAPRAEG9wk,5617.92,3.72,Do not take the responsibility of your
MCAPRAEG9wk,5619.32,4.56,spouse's acts on yourself. You clearly
MCAPRAEG9wk,5621.64,5.84,expressed your sister's wishes. He made
MCAPRAEG9wk,5623.88,6.24,the choice to go directly against them.
MCAPRAEG9wk,5627.48,4.92,Your sister had every right to not want
MCAPRAEG9wk,5630.12,4.28,contact at all with him after that. Who
MCAPRAEG9wk,5632.4,4.32,knows how the kids would have responded
MCAPRAEG9wk,5634.4,4.16,or been more traumatized seeing him
MCAPRAEG9wk,5636.72,3.92,"again?"""
MCAPRAEG9wk,5638.56,4.92,"""You are not petty. You are trying to"
MCAPRAEG9wk,5640.64,5.04,love and respect and support your sister
MCAPRAEG9wk,5643.48,4.84,"in her time of grief."""
MCAPRAEG9wk,5645.68,5.44,"And OP goes, ""Yes."
MCAPRAEG9wk,5648.32,5.32,"I agree, but he's been giving me grief"
MCAPRAEG9wk,5651.12,4.24,about how harsh I was towards him and
MCAPRAEG9wk,5653.64,4.36,that I should have let him attend the
MCAPRAEG9wk,5655.36,5.8,funeral with me completely ignoring the
MCAPRAEG9wk,5658.0,6.16,fact he went against my sister's wishes
MCAPRAEG9wk,5661.16,5.12,and she rightfully wants some space from
