video_id,start,duration,text
MCAPRAEG9wk,3721.68,2.04,"to affect him in any way at this point,"
MCAPRAEG9wk,3723.48,1.88,but
MCAPRAEG9wk,3723.72,3.28,That's true. But you want to honor the
MCAPRAEG9wk,3725.36,4.12,person that everyone loves that had
MCAPRAEG9wk,3727.0,4.84,passed away. That's right. And my gut
MCAPRAEG9wk,3729.48,3.72,"feeling, I still feel even a little bit"
MCAPRAEG9wk,3731.84,3.24,weird about it if they didn't have the
MCAPRAEG9wk,3733.2,2.28,explicit conversation.
MCAPRAEG9wk,3735.08,3.0,Yeah.
MCAPRAEG9wk,3735.48,4.48,But I feel like it should be her
MCAPRAEG9wk,3738.08,3.12,or nobody. Exactly.
MCAPRAEG9wk,3739.96,2.84,I agree with that.
MCAPRAEG9wk,3741.2,3.36,I think where I'm getting really caught
MCAPRAEG9wk,3742.8,3.36,up with this one is I'm not so much
MCAPRAEG9wk,3744.56,3.56,concerned about the people that are
MCAPRAEG9wk,3746.16,4.4,trying to make this decision.
MCAPRAEG9wk,3748.12,5.84,"Like, the grandparents, aka like his"
MCAPRAEG9wk,3750.56,6.4,"parents, Mhm. and the wife, okay, like,"
MCAPRAEG9wk,3753.96,5.4,"yeah, they're affected clearly. Like,"
MCAPRAEG9wk,3756.96,4.84,they're directly involved right now. But
MCAPRAEG9wk,3759.36,4.2,"I look at this child,"
MCAPRAEG9wk,3761.8,3.16,and I don't know if this is from me
MCAPRAEG9wk,3763.56,3.92,having
MCAPRAEG9wk,3764.96,4.68,known people that are adopted and
MCAPRAEG9wk,3767.48,4.52,constantly feel this like
MCAPRAEG9wk,3769.64,4.12,"burning, aching desire, like, ""What"
MCAPRAEG9wk,3772.0,3.96,"about my birth mom? Like, I love my"
MCAPRAEG9wk,3773.76,5.2,"parents that raised me, but what about"
MCAPRAEG9wk,3775.96,3.4,"my birth mom? Why did she give me up?"""
MCAPRAEG9wk,3778.96,3.76,Right.
MCAPRAEG9wk,3779.36,4.56,"They There's something to be said about,"
MCAPRAEG9wk,3782.72,2.64,"you know, children that go through this"
MCAPRAEG9wk,3783.92,4.28,experience of not knowing their birth
MCAPRAEG9wk,3785.36,5.12,"parents, who they feel"
MCAPRAEG9wk,3788.2,4.6,"a part of them is missing, and there's a"
MCAPRAEG9wk,3790.48,3.96,lot of trauma with that.
MCAPRAEG9wk,3792.8,4.8,"I just look at this, I'm like, it's just"
MCAPRAEG9wk,3794.44,6.92,such an unfair situation to bring a kid
MCAPRAEG9wk,3797.6,6.96,into for selfish reasons of my son is
MCAPRAEG9wk,3801.36,7.04,"gone, I want a piece of my son."
MCAPRAEG9wk,3804.56,6.76,"It to me, this seems so selfish."
MCAPRAEG9wk,3808.4,5.2,and or continuing the lineage. Any
MCAPRAEG9wk,3811.32,4.92,reason that the grandparents have is to
MCAPRAEG9wk,3813.6,5.12,"me is selfish cuz it's like, no matter"
MCAPRAEG9wk,3816.24,4.4,"what you do, your son is gone. Mhm."
MCAPRAEG9wk,3818.72,4.12,"Yeah. And I'm so sorry about that, and"
MCAPRAEG9wk,3820.64,4.16,"it's so tragic, but"
MCAPRAEG9wk,3822.84,5.04,to bring a child into the world to
MCAPRAEG9wk,3824.8,5.08,"appease you,"
MCAPRAEG9wk,3827.88,3.2,what? That is really an interesting
MCAPRAEG9wk,3829.88,3.68,"concept to think about. Like, the"
MCAPRAEG9wk,3831.08,4.0,"grandparents, like, are they like, who"
MCAPRAEG9wk,3833.56,3.36,is raising them? Are they raising them?
MCAPRAEG9wk,3835.08,2.72,"And if they are raising them,"
MCAPRAEG9wk,3836.92,2.92,"Yeah, it"
MCAPRAEG9wk,3837.8,3.68,I have 60-year-old patients that die
MCAPRAEG9wk,3839.84,2.88,every day.
MCAPRAEG9wk,3841.48,2.96,What are you going to What Where's this
MCAPRAEG9wk,3842.72,3.48,1-year-old going to go? Is family
MCAPRAEG9wk,3844.44,4.04,automatically going to take them on?
MCAPRAEG9wk,3846.2,2.8,"Take her them on? Like,"
MCAPRAEG9wk,3848.48,2.52,what?
MCAPRAEG9wk,3849.0,3.0,It'd have to be the mom.
MCAPRAEG9wk,3851.0,4.68,"Or the wife, I mean."
MCAPRAEG9wk,3852.0,6.08,"But uh however, I will say, um"
MCAPRAEG9wk,3855.68,3.72,"I I mean, even when people are adopted,"
MCAPRAEG9wk,3858.08,3.0,"like, and they're wondering about their"
MCAPRAEG9wk,3859.4,3.44,"birth parents, I think a part of that is"
MCAPRAEG9wk,3861.08,4.12,because they know their birth parent is
MCAPRAEG9wk,3862.84,3.88,"out there, you know? Or they don't know"
MCAPRAEG9wk,3865.2,3.8,anything about them or something like
MCAPRAEG9wk,3866.72,3.639,"that. Like, I think I don't I think it"
MCAPRAEG9wk,3869.0,3.08,"would be different if you're like, I"
MCAPRAEG9wk,3870.359,3.481,know that my dad died and this was my
MCAPRAEG9wk,3872.08,3.24,"situation, you know?"
MCAPRAEG9wk,3873.84,2.64,Um because he'd be he would be able to
MCAPRAEG9wk,3875.32,2.4,learn about him. The grandparents are
MCAPRAEG9wk,3876.48,1.6,"going to tell him all about him, you"
MCAPRAEG9wk,3877.72,2.72,know?
MCAPRAEG9wk,3878.08,4.279,Yeah. But I um
MCAPRAEG9wk,3880.44,3.6,But I guess like even still growing up
MCAPRAEG9wk,3882.359,3.681,and hearing about your dad and not
MCAPRAEG9wk,3884.04,2.24,"having your dad, Oh, there's That's a"
MCAPRAEG9wk,3886.04,2.44,big
MCAPRAEG9wk,3886.28,4.76,it's it's it's going to It's traumatic
MCAPRAEG9wk,3888.48,4.44,"either way. It's not a ideal situation,"
MCAPRAEG9wk,3891.04,4.2,"and I mean, the only thing I will say"
MCAPRAEG9wk,3892.92,4.12,"though is that with a lot of situations,"
MCAPRAEG9wk,3895.24,3.44,"it's not ideal. Like, there's things"
MCAPRAEG9wk,3897.04,2.68,"from my childhood that I'm like, damn,"
MCAPRAEG9wk,3898.68,3.44,like
MCAPRAEG9wk,3899.72,4.52,I could have been like a cooler person
MCAPRAEG9wk,3902.12,3.239,"if this didn't happen or whatever it is,"
MCAPRAEG9wk,3904.24,3.08,and I
MCAPRAEG9wk,3905.359,4.921,"it's just like life is crazy. So, I"
MCAPRAEG9wk,3907.32,5.08,don't I think more of
MCAPRAEG9wk,3910.28,3.28,this story is just really focusing on
MCAPRAEG9wk,3912.4,3.8,like
MCAPRAEG9wk,3913.56,5.72,"the wife. Yeah. And like, what she wants"
MCAPRAEG9wk,3916.2,4.88,"to decide. And like, if she thinks that"
MCAPRAEG9wk,3919.28,4.2,that's kind of [ __ ] up and crossing
MCAPRAEG9wk,3921.08,5.44,"the line, she's not the [ __ ] Like,"
MCAPRAEG9wk,3923.48,4.44,it's not the [ __ ] for this.
MCAPRAEG9wk,3926.52,4.12,"And so,"
MCAPRAEG9wk,3927.92,5.0,"with that being said, someone comments,"
MCAPRAEG9wk,3930.64,4.24,"""I hope you decide to have his child."
MCAPRAEG9wk,3932.92,3.04,I'd be the same. It's not theirs to
MCAPRAEG9wk,3934.88,4.16,"use."""
MCAPRAEG9wk,3935.96,5.24,"And she goes, ""Me carrying his child"
MCAPRAEG9wk,3939.04,4.08,"isn't really on the table."""
MCAPRAEG9wk,3941.2,4.32,Yeah. He's gone. Yeah.
MCAPRAEG9wk,3943.12,4.12,"And I feel like for her, he's gone."
MCAPRAEG9wk,3945.52,4.08,There's no bringing him back. Then the
MCAPRAEG9wk,3947.24,5.28,sperm should be gone. Done deal.
MCAPRAEG9wk,3949.6,5.2,I agree. I think
MCAPRAEG9wk,3952.52,4.6,he's gone.
MCAPRAEG9wk,3954.8,4.28,As
MCAPRAEG9wk,3957.12,4.08,There's He wanted to raise a kid with
MCAPRAEG9wk,3959.08,4.24,her. Yeah. It'd be such a hard place to
MCAPRAEG9wk,3961.2,4.96,"be put in though. Like, I'm just"
MCAPRAEG9wk,3963.32,6.12,picturing if I had people that loved the
MCAPRAEG9wk,3966.16,6.0,person that I loved like
MCAPRAEG9wk,3969.44,4.28,"as or like, you know, so strongly, too,"
MCAPRAEG9wk,3972.16,2.88,"and they were just so desperate, and I"
MCAPRAEG9wk,3973.72,3.92,was the one who had to make the call to
MCAPRAEG9wk,3975.04,4.4,"like break their heart. Like, I You know"
MCAPRAEG9wk,3977.64,3.96,"what I mean? Like, I"
MCAPRAEG9wk,3979.44,4.08,I'm sure she's just feeling so crazy
MCAPRAEG9wk,3981.6,2.44,"right now. Or like, just so torn and"
MCAPRAEG9wk,3983.52,1.56,like
MCAPRAEG9wk,3984.04,1.64,is so fresh.
MCAPRAEG9wk,3985.08,2.32,Yeah.
MCAPRAEG9wk,3985.68,3.24,"Two weeks, you guys. Like, again, like,"
MCAPRAEG9wk,3987.4,3.84,two weeks. She just lost her life
MCAPRAEG9wk,3988.92,3.84,partner. Mhm. Someone who she They were
MCAPRAEG9wk,3991.24,5.32,actively planning to have a life and
MCAPRAEG9wk,3992.76,5.4,kids together. I can't even imagine like
MCAPRAEG9wk,3996.56,2.6,typing this all out and thinking
MCAPRAEG9wk,3998.16,2.04,"coherently. Like,"
MCAPRAEG9wk,3999.16,2.8,Yeah.
MCAPRAEG9wk,4000.2,4.72,I feel like clarity will come with time.
MCAPRAEG9wk,4001.96,5.399,"Yeah. I really do. Yeah, and again, it's"
MCAPRAEG9wk,4004.92,4.2,"been about two weeks. Like,"
MCAPRAEG9wk,4007.359,4.0,sit on it. Don't make any rash
MCAPRAEG9wk,4009.12,4.04,"decisions. Like, I saw somewhere where"
MCAPRAEG9wk,4011.359,4.161,you shouldn't make any major life
MCAPRAEG9wk,4013.16,3.84,changes for at least 6 to 9 months after
MCAPRAEG9wk,4015.52,2.12,a death. Just don't give it to the
MCAPRAEG9wk,4017.0,2.88,parents.
MCAPRAEG9wk,4017.64,3.64,"Yeah. No, it's it's not theirs."
MCAPRAEG9wk,4019.88,2.32,And it's not what he I really don't
MCAPRAEG9wk,4021.28,2.16,think that's what the husband would have
MCAPRAEG9wk,4022.2,4.12,wanted. And that's what I would just
MCAPRAEG9wk,4023.44,4.76,"say. I'd be I would literally be like,"
MCAPRAEG9wk,4026.32,4.56,"""I don't like the fact that like this"
MCAPRAEG9wk,4028.2,4.48,decision is put in my hands because I
MCAPRAEG9wk,4030.88,3.84,don't like that I'm holding back
MCAPRAEG9wk,4032.68,3.32,something that you guys really want.
MCAPRAEG9wk,4034.72,3.4,"However,"
MCAPRAEG9wk,4036.0,5.08,I know it's not what he wants.
MCAPRAEG9wk,4038.12,5.12,And if I thought even the slightest bit
MCAPRAEG9wk,4041.08,3.6,"if that it was what he would want, then"
MCAPRAEG9wk,4043.24,4.08,this would be a different story. But I
MCAPRAEG9wk,4044.68,4.2,"am so confident that it's not. So, like,"
MCAPRAEG9wk,4047.32,3.72,I don't want to feel like the villain
MCAPRAEG9wk,4048.88,4.32,"here, but"
MCAPRAEG9wk,4051.04,4.88,I am the one who is able to legally call
MCAPRAEG9wk,4053.2,3.4,"the shots, and this is just what I think"
MCAPRAEG9wk,4055.92,1.84,"is right."""
MCAPRAEG9wk,4056.6,3.04,Exactly.
MCAPRAEG9wk,4057.76,4.4,Legality is also a very important point
MCAPRAEG9wk,4059.64,4.4,in this because depending on the
MCAPRAEG9wk,4062.16,4.8,paperwork that they filed when they did
MCAPRAEG9wk,4064.04,4.52,"do the sperm donation {slash} saving it,"
MCAPRAEG9wk,4066.96,4.16,"depending on what state, apparently it's"
MCAPRAEG9wk,4068.56,5.799,"a big thing. So, one of the top comments"
MCAPRAEG9wk,4071.12,5.32,"is, ""Not the [ __ ] Though to this"
MCAPRAEG9wk,4074.359,4.321,"Though, the decision may not actually be"
MCAPRAEG9wk,4076.44,4.16,yours to make anyways. If you contact
MCAPRAEG9wk,4078.68,3.56,"the sperm bank where it's frozen, they"
MCAPRAEG9wk,4080.6,3.48,may likely have procedures on what
MCAPRAEG9wk,4082.24,2.88,happens in the situations of the donor's
MCAPRAEG9wk,4084.08,3.32,death.
MCAPRAEG9wk,4085.12,4.48,There may be terms that he agreed to in
MCAPRAEG9wk,4087.4,5.04,the paperwork that may state ownership
MCAPRAEG9wk,4089.6,5.36,"transfers to yourself, or it may state"
MCAPRAEG9wk,4092.44,5.24,that the sample is destroyed. Contact
MCAPRAEG9wk,4094.96,4.92,"them and see what they say. Though, if"
MCAPRAEG9wk,4097.68,4.0,"ownership is now yours, I don't blame"
MCAPRAEG9wk,4099.88,3.64,"you at all for saying no."""
MCAPRAEG9wk,4101.68,4.24,"OP replies,"
MCAPRAEG9wk,4103.52,4.799,"""Ownership is mine."""
MCAPRAEG9wk,4105.92,4.399,"And someone comments back, ""You are so"
MCAPRAEG9wk,4108.319,4.201,"selfish."""
MCAPRAEG9wk,4110.319,4.281,"And she goes, ""For the legal ownership"
MCAPRAEG9wk,4112.52,3.839,"passing to me after his death?"""
MCAPRAEG9wk,4114.6,3.68,{question mark}
MCAPRAEG9wk,4116.359,6.521,"And the person literally responds back,"
MCAPRAEG9wk,4118.28,8.16,"""Everything is me, me, me."""
MCAPRAEG9wk,4122.88,8.0,Okay. This woman just lost her [ __ ]
MCAPRAEG9wk,4126.44,6.04,husband. Wow. This is where I get mad of
MCAPRAEG9wk,4130.88,2.16,people being able to be anonymous on the
MCAPRAEG9wk,4132.48,1.239,internet.
MCAPRAEG9wk,4133.04,4.2,Ugh.
MCAPRAEG9wk,4133.719,5.841,Because what a goddamn troll. Literally.
MCAPRAEG9wk,4137.24,3.4,Yeah. I I think was I I was saying this
MCAPRAEG9wk,4139.56,2.6,"to you, Lauren, right?"
MCAPRAEG9wk,4140.64,3.52,We've talked about this a lot.
MCAPRAEG9wk,4142.16,3.92,I think that it should be outlawed that
MCAPRAEG9wk,4144.16,4.12,people are able to just create all these
MCAPRAEG9wk,4146.08,3.8,different usernames and just be trolls
MCAPRAEG9wk,4148.28,4.72,"on the internet. Like, if you want to"
MCAPRAEG9wk,4149.88,5.32,"say what you want to say, then have a"
MCAPRAEG9wk,4153.0,3.68,"face and a name to it, you know? Like, I"
MCAPRAEG9wk,4155.2,3.32,think that's totally fine to express
MCAPRAEG9wk,4156.68,4.96,yourself and have that freedom of speech
MCAPRAEG9wk,4158.52,4.72,"and everything, but it is so it's gotten"
MCAPRAEG9wk,4161.64,4.52,"so toxic and dangerous, the fact that"
MCAPRAEG9wk,4163.24,5.119,"people can just hide behind these like,"
MCAPRAEG9wk,4166.16,5.24,I love CutiePie563
MCAPRAEG9wk,4168.359,7.361,and say evil things to people like that
MCAPRAEG9wk,4171.4,7.16,is so wrong. So I don't know. It says a
MCAPRAEG9wk,4175.72,5.68,lot about the people that do do that. It
MCAPRAEG9wk,4178.56,4.56,says a lot that you feel like you
MCAPRAEG9wk,4181.4,4.32,there's a reason you're hiding behind
MCAPRAEG9wk,4183.12,4.639,some fake little name. There's a reason.
MCAPRAEG9wk,4185.72,3.0,There's clearly a reason. You're a
MCAPRAEG9wk,4187.759,2.841,coward and
MCAPRAEG9wk,4188.72,3.76,And they have nothing better to do.
MCAPRAEG9wk,4190.6,4.68,You're being cruel for the sake of being
MCAPRAEG9wk,4192.48,4.4,cruel because
MCAPRAEG9wk,4195.28,3.68,what is this going to get you? Who is
MCAPRAEG9wk,4196.88,3.4,this going to benefit? You are being
MCAPRAEG9wk,4198.96,3.4,cruel
MCAPRAEG9wk,4200.28,4.76,for whatever malicious reason that is.
MCAPRAEG9wk,4202.36,4.84,"Well, they're just taking out whatever"
MCAPRAEG9wk,4205.04,3.88,like frustrations or whatever the [ __ ]
MCAPRAEG9wk,4207.2,3.4,they have to Everyone's fighting their
MCAPRAEG9wk,4208.92,3.16,own battles and yeah it could be it
MCAPRAEG9wk,4210.6,3.64,could be an outlet.
MCAPRAEG9wk,4212.08,2.84,Um wait sorry Morgan could I interject
MCAPRAEG9wk,4214.24,2.6,for a second?
MCAPRAEG9wk,4214.92,3.84,Yeah. So I
MCAPRAEG9wk,4216.84,4.48,I'm just
MCAPRAEG9wk,4218.76,4.44,thinking that um
MCAPRAEG9wk,4221.32,3.56,when you talked about the adoption thing
MCAPRAEG9wk,4223.2,3.4,and you're like even like people like
MCAPRAEG9wk,4224.88,2.48,you know like are always wondering and
MCAPRAEG9wk,4226.6,2.0,stuff like that.
MCAPRAEG9wk,4227.36,4.08,I'm going to actually what I was going
MCAPRAEG9wk,4228.6,5.0,to add to that is I was going to say hey
MCAPRAEG9wk,4231.44,3.52,I'm actually going to phone a friend for
MCAPRAEG9wk,4233.6,3.32,a part of this and I'm going to reach
MCAPRAEG9wk,4234.96,4.64,out to my roommate Erin Sela and have
MCAPRAEG9wk,4236.92,3.96,her interject on this story. But no but
MCAPRAEG9wk,4239.6,2.96,like what I wanted to say is that
MCAPRAEG9wk,4240.88,3.4,because we're talking about like should
MCAPRAEG9wk,4242.56,2.88,there be a child be brought into this
MCAPRAEG9wk,4244.28,1.88,world or not?
MCAPRAEG9wk,4245.44,2.72,Yeah.
MCAPRAEG9wk,4246.16,3.36,Then I think people who are adopted are
MCAPRAEG9wk,4248.16,2.96,going to be like what so I don't know
MCAPRAEG9wk,4249.52,3.16,who my parents are and so I shouldn't
MCAPRAEG9wk,4251.12,2.52,have been brought into this world. I
MCAPRAEG9wk,4252.68,2.32,just think they're going to make that
MCAPRAEG9wk,4253.64,3.56,parallel. Really?
MCAPRAEG9wk,4255.0,4.72,I'm saying? What do you think Justin?
MCAPRAEG9wk,4257.2,3.88,get that much of a vibe because
MCAPRAEG9wk,4259.72,2.76,at the same time when you're talking
MCAPRAEG9wk,4261.08,3.84,about like
MCAPRAEG9wk,4262.48,3.72,babies that weren't planned
MCAPRAEG9wk,4264.92,2.36,it's like that's what you say about
MCAPRAEG9wk,4266.2,3.6,yourself all the time.
MCAPRAEG9wk,4267.28,5.32,Oh I am literally a and I am an oops
MCAPRAEG9wk,4269.8,5.28,baby 100%.
MCAPRAEG9wk,4272.6,3.56,Well actually my mom is which makes me
MCAPRAEG9wk,4275.08,3.08,like
MCAPRAEG9wk,4276.16,6.2,technically one. I think it was super
MCAPRAEG9wk,4278.16,5.64,valid because my ex was
MCAPRAEG9wk,4282.36,4.88,I think
MCAPRAEG9wk,4283.8,5.04,technically adopted but she knew her
MCAPRAEG9wk,4287.24,4.2,biological dad but didn't know her
MCAPRAEG9wk,4288.84,6.72,biological mom at all or something.
MCAPRAEG9wk,4291.44,5.2,And I think everything she said was very
MCAPRAEG9wk,4295.56,1.84,on point
MCAPRAEG9wk,4296.64,2.32,on point.
MCAPRAEG9wk,4297.4,2.88,with what she experienced and kind of
MCAPRAEG9wk,4298.96,2.76,that so
MCAPRAEG9wk,4300.28,3.12,there was nothing that stuck out to me
MCAPRAEG9wk,4301.72,3.16,where I'm like
MCAPRAEG9wk,4303.4,2.72,okay. That's fine. I was just saying
MCAPRAEG9wk,4304.88,2.56,because we're talking about the concept
MCAPRAEG9wk,4306.12,3.8,of bringing a life into the world or
MCAPRAEG9wk,4307.44,4.16,not. I'm just I could see that people
MCAPRAEG9wk,4309.92,3.44,like I could just see people making this
MCAPRAEG9wk,4311.6,2.6,parallel of being like wait so you don't
MCAPRAEG9wk,4313.36,2.24,think I should have been brought in the
MCAPRAEG9wk,4314.2,2.76,world just because I'm [ __ ] up over
MCAPRAEG9wk,4315.6,3.52,the fact I don't know who my parents are
MCAPRAEG9wk,4316.96,4.04,my biological. No no no no no no no no.
MCAPRAEG9wk,4319.12,3.08,I mean again I think it would be a point
MCAPRAEG9wk,4321.0,2.72,to like
MCAPRAEG9wk,4322.2,3.52,we can add this in because I think this
MCAPRAEG9wk,4323.72,4.12,is very important to have.
MCAPRAEG9wk,4325.72,3.28,I'm going off of like
MCAPRAEG9wk,4327.84,4.08,I had a college roommate that was
MCAPRAEG9wk,4329.0,4.84,adopted and I've had other friends that
MCAPRAEG9wk,4331.92,4.0,were adopted and
MCAPRAEG9wk,4333.84,2.56,they are very very happy they're there.
MCAPRAEG9wk,4335.92,2.6,Right.
MCAPRAEG9wk,4336.4,4.16,They're very Yeah.
MCAPRAEG9wk,4338.52,3.6,thankful for their adoptive parents.
MCAPRAEG9wk,4340.56,3.56,They love their adoptive parents. They
MCAPRAEG9wk,4342.12,3.8,have a great relationship with them.
MCAPRAEG9wk,4344.12,3.44,But I've also heard the opposite where
MCAPRAEG9wk,4345.92,2.92,people's adoptive parents haven't been
MCAPRAEG9wk,4347.56,3.6,great.
MCAPRAEG9wk,4348.84,4.6,But from my experience
MCAPRAEG9wk,4351.16,4.84,no matter how great the relationship is
MCAPRAEG9wk,4353.44,4.52,with the adoptive parents my friends
MCAPRAEG9wk,4356.0,4.16,that have been adopted have always like
MCAPRAEG9wk,4357.96,3.2,had this yearning to find their birth
MCAPRAEG9wk,4360.16,2.68,mom
MCAPRAEG9wk,4361.16,2.92,or find their birth parents.
MCAPRAEG9wk,4362.84,3.68,And I just think it's like this kind of
MCAPRAEG9wk,4364.08,4.28,like it's just this innate nature to
MCAPRAEG9wk,4366.52,3.48,like either whether it's like know where
MCAPRAEG9wk,4368.36,4.16,you come from
MCAPRAEG9wk,4370.0,4.96,know who you are a part of. I don't know
MCAPRAEG9wk,4372.52,3.96,I don't I don't know personally but I
MCAPRAEG9wk,4374.96,2.76,just think it's a conversation to be had
MCAPRAEG9wk,4376.48,4.88,and
MCAPRAEG9wk,4377.72,6.68,I think I will include because I in my
MCAPRAEG9wk,4381.36,4.4,head when we were recording that segment
MCAPRAEG9wk,4384.4,3.24,I was like I'm going to send her the
MCAPRAEG9wk,4385.76,3.92,story and be like hey
MCAPRAEG9wk,4387.64,3.04,I know you're adopted. I know you have a
MCAPRAEG9wk,4389.68,2.04,great relationship with your birth
MCAPRAEG9wk,4390.68,3.12,parents.
MCAPRAEG9wk,4391.72,3.2,I'll let Erin tell it if like I start
MCAPRAEG9wk,4393.8,4.08,crying.
MCAPRAEG9wk,4394.92,5.84,Uh so it's so tough like this [ __ ] just
MCAPRAEG9wk,4397.88,5.08,[ __ ] hits me but I'll let Erin tell
MCAPRAEG9wk,4400.76,4.32,it if she's willing
MCAPRAEG9wk,4402.96,4.12,um but Erin like kind of went through
MCAPRAEG9wk,4405.08,4.16,that experience so
MCAPRAEG9wk,4407.08,4.56,we're going to phone a friend.
MCAPRAEG9wk,4409.24,4.2,I know [ __ ] I would for sure have that
MCAPRAEG9wk,4411.64,4.16,I would for sure have that yearning.
MCAPRAEG9wk,4413.44,4.52,Yeah. Put yourself in that situation
MCAPRAEG9wk,4415.8,4.0,you'd be like I know and like I said I I
MCAPRAEG9wk,4417.96,2.96,in no way like Morgan I know your heart
MCAPRAEG9wk,4419.8,2.88,and I know everything you're saying. I
MCAPRAEG9wk,4420.92,3.84,totally was like on board with what
MCAPRAEG9wk,4422.68,3.64,you're saying. I just know that we we
MCAPRAEG9wk,4424.76,3.56,get so sick of people like making
MCAPRAEG9wk,4426.32,3.52,assumptions and so I was just trying to
MCAPRAEG9wk,4428.32,2.0,be like It's good it's good to clarify
MCAPRAEG9wk,4429.84,2.16,so
MCAPRAEG9wk,4430.32,2.48,Yeah. if
MCAPRAEG9wk,4432.0,2.56,um
MCAPRAEG9wk,4432.8,3.64,if you tune into the YouTube version
MCAPRAEG9wk,4434.56,4.8,I'll phone a friend.
MCAPRAEG9wk,4436.44,5.04,I have no doubt she'll respond.
MCAPRAEG9wk,4439.36,3.28,So that'll be on the YouTube version and
MCAPRAEG9wk,4441.48,4.04,here's where I'm going to cut so I can
MCAPRAEG9wk,4442.64,2.88,get my [ __ ] together.
MCAPRAEG9wk,4500.24,3.92,So I think we covered everything with
MCAPRAEG9wk,4502.08,3.48,that one. I think
MCAPRAEG9wk,4504.16,3.4,thank you for bringing that up. I I
MCAPRAEG9wk,4505.56,4.72,obviously don't want people that are
MCAPRAEG9wk,4507.56,5.68,adopted to feel like they're any less or
MCAPRAEG9wk,4510.28,5.2,shouldn't be here because I think that
MCAPRAEG9wk,4513.24,2.4,it's definitely important to to make
MCAPRAEG9wk,4515.48,1.84,note of.
MCAPRAEG9wk,4515.64,3.6,what you were saying. It's not what I
MCAPRAEG9wk,4517.32,4.92,was saying but
MCAPRAEG9wk,4519.24,5.76,I think it's very easy to when you feel
MCAPRAEG9wk,4522.24,4.72,personal about something
MCAPRAEG9wk,4525.0,4.64,to kind of infer. I think it's really
MCAPRAEG9wk,4526.96,4.84,easy to like misinterpret things and so
MCAPRAEG9wk,4529.64,4.0,I don't I don't want there to be any
MCAPRAEG9wk,4531.8,4.96,misinterpretation. Like
MCAPRAEG9wk,4533.64,4.16,a child that's adoption adopted is just
MCAPRAEG9wk,4536.76,2.8,as
MCAPRAEG9wk,4537.8,4.36,valuable and their life is just as
MCAPRAEG9wk,4539.56,4.4,important and are like
MCAPRAEG9wk,4542.16,3.76,I just don't want anything negative
MCAPRAEG9wk,4543.96,4.52,inferred from that. I'm just saying like
MCAPRAEG9wk,4545.92,5.32,in this situation
MCAPRAEG9wk,4548.48,5.04,I think it is unfair.
MCAPRAEG9wk,4551.24,4.64,This it's just sperm. It's not even a
MCAPRAEG9wk,4553.52,4.96,child. It's not like it's inseminated
MCAPRAEG9wk,4555.88,5.28,eggs. It is purely sperm.
MCAPRAEG9wk,4558.48,4.44,Yeah. Which
MCAPRAEG9wk,4561.16,3.72,like how many how
MCAPRAEG9wk,4562.92,5.8,how many seeds have been flushed
MCAPRAEG9wk,4564.88,7.44,swallowed or thrown away? Yeah.
MCAPRAEG9wk,4568.72,4.24,This is just sperm. This is not a baby.
MCAPRAEG9wk,4572.32,4.28,Wiped.
MCAPRAEG9wk,4572.96,6.08,Wiped up. Towel towel time. Towel time.
MCAPRAEG9wk,4576.6,4.44,So I I'm glad you brought that up
MCAPRAEG9wk,4579.04,4.72,because now we can include it and just
MCAPRAEG9wk,4581.04,4.84,feel like all of our boxes were
MCAPRAEG9wk,4583.76,4.24,were checked in.
MCAPRAEG9wk,4585.88,5.64,Let me just shut the [ __ ] up. Someone
MCAPRAEG9wk,4588.0,5.36,else want to read? [ __ ] I don't know if
MCAPRAEG9wk,4591.52,4.32,I'd be a good reader.
MCAPRAEG9wk,4593.36,4.24,Well I kind of like it. I honestly
MCAPRAEG9wk,4595.84,4.08,thought that reading would be way more
MCAPRAEG9wk,4597.6,5.24,smooth but then I remembered that I have
MCAPRAEG9wk,4599.92,5.16,like like reading anxiety.
MCAPRAEG9wk,4602.84,3.8,Same. Where it's like whenever people
MCAPRAEG9wk,4605.08,5.24,would popcorn me
MCAPRAEG9wk,4606.64,4.8,I'd be like no. Oh I love popcorn. No.
MCAPRAEG9wk,4610.32,2.88,Shoot me.
MCAPRAEG9wk,4611.44,4.24,I like it's like I know how to read but
MCAPRAEG9wk,4613.2,5.72,it's just like the the fluctuation of my
MCAPRAEG9wk,4615.68,4.64,voice and like when when commas come and
MCAPRAEG9wk,4618.92,3.4,I don't see them and they all of a
MCAPRAEG9wk,4620.32,4.0,sudden they're there and I'm just like I
MCAPRAEG9wk,4622.32,3.8,pause and then That stuff just doesn't
MCAPRAEG9wk,4624.32,3.52,bother me. Yeah it's all
MCAPRAEG9wk,4626.12,3.44,with that being said
MCAPRAEG9wk,4627.84,3.92,here you go. Really? Yeah we're going to
MCAPRAEG9wk,4629.56,4.6,pass it DOWN THE LINE. WHAT?
MCAPRAEG9wk,4631.76,4.04,You're going to popcorn me?
MCAPRAEG9wk,4634.16,5.8,That's [ __ ] up. I just told you my
MCAPRAEG9wk,4635.8,4.16,trauma from grade school.
MCAPRAEG9wk,4640.0,4.6,All right let's let the real show begin.
MCAPRAEG9wk,4642.68,4.8,I needed a break after that last one. It
MCAPRAEG9wk,4644.6,5.88,was intense. So
MCAPRAEG9wk,4647.48,4.64,we have a lot of awards on this one.
MCAPRAEG9wk,4650.48,4.16,Am I the [ __ ] for not taking my
MCAPRAEG9wk,4652.12,4.44,husband to my brother-in-law's funeral
MCAPRAEG9wk,4654.64,3.52,after he went against my sister's
MCAPRAEG9wk,4656.56,4.0,wishes?
MCAPRAEG9wk,4658.16,4.64,My sister's husband was sick for over 6
MCAPRAEG9wk,4660.56,3.6,months. In the past couple of months he
MCAPRAEG9wk,4662.8,3.8,got worse.
MCAPRAEG9wk,4664.16,5.12,They have two kids nephew four and niece
MCAPRAEG9wk,4666.6,4.8,six. I agreed to take the kids in to
MCAPRAEG9wk,4669.28,3.72,look after them and help my sister focus
MCAPRAEG9wk,4671.4,4.64,on her husband.
MCAPRAEG9wk,4673.0,5.64,A week ago I got a call at 6:50 from my
MCAPRAEG9wk,4676.04,4.36,sister crying telling me her husband had
MCAPRAEG9wk,4678.64,3.64,just passed away.
MCAPRAEG9wk,4680.4,4.08,It was so devastating.
MCAPRAEG9wk,4682.28,3.64,I was still in bed when I got the news.
MCAPRAEG9wk,4684.48,2.64,I checked on the kids and they were
MCAPRAEG9wk,4685.92,2.84,asleep.
MCAPRAEG9wk,4687.12,2.56,I had to go see my sister and be with
MCAPRAEG9wk,4688.76,2.6,her.
MCAPRAEG9wk,4689.68,3.56,I asked my husband to keep an eye on the
MCAPRAEG9wk,4691.36,3.88,kids and warned him not to tell them
MCAPRAEG9wk,4693.24,4.04,about their father's passing till their
MCAPRAEG9wk,4695.24,4.64,mom got there and could tell them
MCAPRAEG9wk,4697.28,4.28,herself in her own way since she made me
